,doi,abstract,volume,issue
20,https://doi.org/10.2514/1.J055978,"Problems in three-dimensional aerodynamic shape optimization can produce complex design spaces due to the nonlinear physics of the Navier–Stokes equations and the large number of design variables used. In this paper, a Newton–Krylov optimization algorithm is applied to a set of complex aerodynamic optimization problems in order to investigate its behaviour and performance. The methodology solves the Reynolds-averaged Navier–Stokes equations with a parallel Newton–Krylov algorithm. Aerodynamic geometries are meshed using structured multiblock grids, which are then fitted with B-spline control volumes for mesh deformation and geometry control. A gradient-based optimization method is used, with adjoint variables calculated using a Krylov method. The optimization of the Common Research Model (CRM) wing is revisited, with a focus on the effect of varying geometric constraints and on the possibility of multimodality. In addition, several cases are presented that involve a high degree of shape change: two planform optimizations starting from a rectangular wing, and investigation of various wingtip treatments. The results characterize the methodology, demonstrating its robustness and ability to address optimization problems with substantial geometric freedom.",56,1
21,https://doi.org/10.2514/1.J056057,"An experimental characterization of the acoustic behavior and the flowfield past several wall-mounted porous fences is presented. Particle image velocimetry is conducted in the near field of the fences. It shows a spanwise periodicity (associated with the periodic geometry of the grid) of regions where well-defined wakes appear as opposed to regions with a lower mass flow rate influenced by strong recirculations. The acoustic behavior is characterized using a microphone array enabling the spatial location of noise sources to be determined. Broadband noise is observed for all grids except for the fractal square grid, where a clear peak appears. The intensity of noise spectra displays scalability with Mach number (dipoles), and the preferential frequency for the fractal square case is shown to scale with the freestream velocity (suggesting a shedding mechanism). For certain grids, the mean and instantaneous spatial locations of the noise sources also present a spanwise preferential arrangement coincident with regions where the flow presents well-defined wakes. Regarding the intermittency of the unsteady sources, they present smaller temporal width, separation, and spatial extent for increasing freestream velocity. However, the ratio between these quantities seems to be constant to within 6% for different Mach numbers.",56,1
22,https://doi.org/10.2514/1.J056023,"The dynamics of a supersonic jet emanating from a high-aspect-ratio rectangular nozzle is investigated using dynamic mode decomposition. In the analysis, dynamic mode decomposition is applied to flowfield data obtained from a large-eddy simulation and the significance of each extracted mode to the snapshot data series is determined using a sparsity-promoting method. Furthermore, in order to assess the validity of the resulting modes, they are compared with the unprocessed large-eddy simulation data in terms of frequency content, sound pressure levels, and space–time correlations. It is found that the accuracy of the modes predicted by the dynamic mode decomposition is sufficient and that the modes deemed as most important give a good representation of the jet flow dynamics. Moreover, the jet flow, at the simulated conditions, is known (from experiments) to be dominated by a screech mechanism. The dynamic mode decomposition methodology, as set up in the present study, is able to isolate the jet screech mode, and the frequency of the extracted mode is in excellent agreement with previous observations.",56,1
23,https://doi.org/10.2514/1.J055751,"In this study, the noise generated from a cold supersonic circular twin jet is simulated with a high-order finite difference solver. The three-dimensional compressible Favre-filtered Navier–Stokes equations in Cartesian form are solved by computational aeroacoustics methods. To handle the complex geometry of two closely spaced circular nozzles, the grid block interface flux reconstruction method for high-order finite difference scheme is used. The supersonic twin jet with fully expanded Mach number 1.358 is simulated in this study. A single jet operating at the same condition is also computed for comparison. It is found that the two coupling jets are both oscillating in flapping mode but out of phase with each other. Therefore the near-field pressure is symmetric about two planes, the midplane separating the two nozzles and the plane involving the two jets’ axes. The computed noise spectra are compared with the experimental data of Walker [“Twin Jet Screech Suppression Concepts Tested for 4.7% Axisymmetric and Two-Dimensional Nozzle Configurations,” AIAA Paper 1990–2150, 1990]. The dominant and first harmonic modes in the twin jet are amplified dramatically comparing with the single jet. An increment of 12 dB for the dominant component is observed, whereas 17 dB for the first harmonic. The predicted amplitudes of the screech tone and its harmonic agree well with the experimental data. Comparing with the single jet, a frequency shift of the screech tone in the twin jet is observed. The pressure field of the jet plumes is analyzed with the dynamic mode decomposition (DMD) method. The eigenvalues and most energetic eigen-modes are presented. The coupling mechanism of the twin jet is analyzed based on the DMD results. The upstream shift of the DMD modes in the twin jet indicates stronger interactions between the instability waves and the shock cells, which generate stronger tone noise. The stronger interactions in turn alter the shock-cell length and the convective velocity of the instability waves and result in the frequency shift of the screech tone in the twin jet.",56,1
24,https://doi.org/10.2514/1.J055526,"An experimental and computational fluid dynamics study is reported of supersonic jets issuing from a high-aspect-ratio rectangular convergent–divergent nozzle with and without a scarfed exit. Schlieren visualization and laser Doppler anemometry measurements captured near-field aerodynamic development of an unheated jet at overexpanded, design, and underexpanded conditions. Reynolds-averaged Navier–Stokes computational fluid dynamics predictions using an eddy viscosity closure (Spalart–Allmaras model) for clean and scarfed geometries were compared with measurements to examine the ability to capture nozzle scarfing effects. The measured plume shape for a scarfed nozzle was strongly affected at overexpanded conditions (a distorted four-lobe shape was observed), whereas a rectangular shape was retained for underexpanded flow although plume bifurcation occurred. The development of the plume shape and the mixing rate was a consequence of the strong vortices that occur with rectangular nozzles, with extra vortices introduced by scarfing. The nozzle exit static pressure changed dramatically when scarfing was added, influencing plume secondary flows and near-field development. The main features of scarfed jet development were predicted qualitatively correctly; the four-lobe overexpanded shape was reproduced but the strength of pressure-driven secondary velocities was overpredicted. The experimental data provided represent a challenging validation test case for computational fluid dynamics studies of three-dimensional supersonic jet plumes with scarfed interaction effects.",56,1
25,https://doi.org/10.2514/1.J056121,"Supersonic fan tones are a critical issue for large fans; it is well known that these tones are a key noise source at high-power operating conditions for modern turbofan aeroengines. Nonlinear propagation of the rotor-locked pressure field generated in a turbofan intake duct is calculated by implementing a nonlinear weak-shock theory numerically via a combined time-/frequency-domain algorithm. The aim of the prediction method is to model the nonlinear attenuation and liner absorption of the rotor-locked pressure field within the intake duct. In this hybrid method, the time-domain approach provides a robust and accurate prediction of the nonlinear attenuation, whereas the frequency domain is required to represent the liner attenuation. The focus of this work is to compare the time-/frequency-domain method with time-domain or frequency-domain methods that have been developed previously to calculate the nonlinear propagation of the rotor-locked pressure field in either a rigid or lined intake duct, respectively. The capability of the time-/frequency-domain method to accurately calculate the nonlinear propagation of the rotor-locked pressure field, which can provide an engineering method for buzzsaw noise prediction, is demonstrated.",56,1
26,https://doi.org/10.2514/1.J056166,"To study the duct curvature effects on a shock train in rectangular hypersonic inlet/isolator models, four curved isolators are designed and tested at a freestream Mach number of 4.92. Strong interactions between the shock train and background waves are encountered. In small curvature isolators, the shock train intersects with the left-running or right-running shock stably, with the massive separation situated near the top or bottom wall, respectively; whereas the large separation always locates near the bottom wall in large curvature isolators. When the shock train switches from intersecting with one background shock to another, rapid forward movement occurs in large curvature isolators; whereas violent flow oscillations may appear in small curvature isolators. The radial pressure gradient direction in the shock train region alternatively changes from being centripetal to being centrifugal in small curvature isolators, whereas the direction remains centripetal in large curvature isolators due to the enhanced left-running expansion waves and right-running compression waves. In addition, the amplitude of the radial pressure gradient increases with the duct curvature, which induces significant secondary flow and accumulates a large amount of low-energy fluid near the bottom surface. On the other hand, the streamwise adverse pressure gradient in the shock train decreases with the duct curvature, resulting in a longer and weaker shock train, and the maximum sustainable backpressure ratio decreases with a percentage as high as 17% of that of straight isolator. Besides, the root-mean-square values of static pressure on the exit plane can be reduced to some extent by increasing the duct curvature. In general, large duct curvature has detrimental effects on the shock train characteristics, but adequate duct curvature can help to avoid violent flow oscillation and decrease pressure fluctuating level.",56,1
27,https://doi.org/10.2514/1.J056183,"Interaction of shock waves with turbulent boundary layers can enhance the surface heat flux dramatically. Reynolds-averaged Navier–Stokes simulations based on a constant turbulent Prandtl number often give grossly erroneous heat transfer predictions in shock/boundary-layer interaction flows. This is due to the fact that the underlying Morkovin’s hypothesis breaks down in the presence of shock waves; thus, the turbulent Prandtl number cannot be assumed to be a constant. In this paper, a new variable turbulent Prandtl number model based on linearized Rankine–Hugoniot conditions applied to shock–turbulence interaction is developed. The turbulent Prandtl number is a function of the shock strength, and a shock function is proposed to identify the location and strength of shock waves. The shock function also simulates the postshock relaxation of the turbulent heat flux, which is akin to that observed in canonical shock–turbulence interaction. The model is combined with the well-validated shock-unsteadiness model and is applied to the complex shock topology observed in oblique shock/turbulent boundary-layer interactions. Comparison with experimental data shows significant improvement in the surface heat transfer rate in the interaction region, both for attached and separated shock/boundary-layer interaction cases. The shock function is also used to propose a robust form of the existing shock-unsteadiness model that simplifies the numerical implementation enormously.",56,1
28,https://doi.org/10.2514/1.J055915,"An investigation of hypersonic shock wave interactions on a V-shaped blunt leading edge (which is commonly designed in hypersonic inlets) is conducted, focusing on the effects of the geometry of the leading edge and the freestream Mach number. Experimental schlieren images were compared with the wave patterns obtained from numerical simulations, showing good agreement. The shock interaction in the crotch region creates a very complex flow-field and an uneven distribution of the surface heat flux. An extremely high heat flux caused by a shock-wave/boundary-layer interaction, a shear layer attachment, or an impingement of the supersonic jets occurs over a narrow region. The numerical results indicate that the local surface heat flux can be up to 24 times the stagnation-point value computed using the Fay–Riddell correlation. Moreover, increasing the leading edge bluntness may have a significant negative effect on the thermal protection of the crotch caused by the shock interaction. Designing a hypersonic V-shaped leading edge involves a compromise between making the leading edge sharp enough to avoid a complex shock interaction flow and blunt enough to reduce the stagnation-point heat flux.",56,1
29,https://doi.org/10.2514/1.J056242,"A helicopter flying through an atmosphere containing particulates may accumulate high electrostatic charges that can challenge its operational safety. In this paper the influence of the helicopter configuration on its electrification is reported. The current study is based on a recently developed numerical approach in which the turbulent airflow around the rotorcraft is estimated via large-eddy simulations, whereas the particulate flow is computed via Lagrangian particle tracking. Also, this approach incorporates a model for the triboelectric charge transfer during particle–helicopter collisions that is briefly described herein. The configurations examined in the study include rotor systems equipped with two, three, or four blades. Also investigated are the effects of the rotor size and its rotational frequency. The current results predict that a helicopter with fewer blades accumulates less electric current, even though the charge on each individual blade is higher. Furthermore, the location of the charge buildup on the rotor disk depends strongly on the number of blades. Also, according to current computations, a reduction of the rotor size leads to a reduction of its electrification, even if the blade tip velocity is kept constant.",56,1
30,https://doi.org/10.2514/1.J055255,"The natural frequencies of toroidal shells of revolution with a hollow elliptical cross section and variable thickness are determined by the Ritz method from a three-dimensional theory, whereas traditional shell theories are mathematically two-dimensional. Instead of ordinary algebraic polynomials, the Legendre polynomials, which are mathematically orthonormal, are used as admissible functions. The present analysis is based upon the circular cylindrical coordinates, whereas toroidal coordinates have been used in general. The potential and kinetic energies of the torus are formulated, and upper bound values of the frequencies are obtained by minimizing the frequencies. Convergence to a four-digit exactitude is demonstrated for the first five frequencies of the torus. Comparisons are made between the frequencies from the present three-dimensional method, a two-dimensional thin-shell theory, and thin- and thick-ring theories. The present method is applicable to very thick shells as well as thin shells.",56,1
31,https://doi.org/10.2514/1.J055960,"The paper presents analyses that were performed with the EZNSS flow solver for the second Aeroelastic Prediction Workshop. The reference test cases for the Aeroelastic Prediction Workshop are based on two wind-tunnel experiments of the Benchmark Supercritical Wing, including a flutter test and forced excitation tests. Three cases are addressed at different transonic flow conditions: two cases at lower Mach numbers of 0.7 and 0.74 and 3 and 0 deg angles of attack, respectively; and one more physically complex case at Mach 0.85 and a 5 deg angle of attack. The cases are analyzed with the EZNSS code, using several computational setups and turbulence models. The simulations are able to predict relatively accurately the flutter response and the response to prescribed motion at the lower Mach number. The higher-Mach-number case, which involves a strong shock, separated flow behind the shock, and some flow unsteadiness, is more challenging. In the static analysis, different turbulence models yield different upper-surface shock positions, and none of the models are able to capture accurately the pressure recovery behind the shock. However, the unsteady aerodynamic response to prescribed pitch motion is simulated with good correlation to the wind-tunnel data. The paper also presents flutter predictions based on unsteady aerodynamic reduced-order modeling, thus validating and assessing the efficiency of the reduced-order modeling and the flutter prediction methodology.",56,1
32,https://doi.org/10.2514/1.J055666,"In this paper, the accuracy of the Craig–Bampton method, one of the most widely used component mode synthesis methods, is improved. Considering the higher-order effect of residual modes that are simply truncated in the Craig–Bampton method, the original finite element model can be more accurately reduced. In this formulation, unknown eigenvalues are considered as additional generalized coordinates, which can be eliminated by employing the concept of system equivalent reduction expansion process. The new component mode synthesis is named the higher-order Craig–Bampton method. The formulation of the higher-order Craig–Bampton method is presented, and its improved accuracy is demonstrated through various examples.",56,1
33,https://doi.org/10.2514/1.J056039,"Analytical expressions for the energy release rate and mode-mixity phase angle are derived for a sandwich composite double-cantilever beam fracture specimen with the face sheets reinforced by stiff plates. The sandwich beam is considered symmetric, with identical top and bottom facesheets. Only a pure moment loading is considered. The -integral coupled with laminate beam theory is employed to derive closed-form expression for the energy release rate in terms of the applied moments, geometry, and material properties. A scalar quantity is obtained to express the mode-mixity phase angle. It is shown that is independent of the applied loading conditions. The value of is found to be moderately influenced by reinforcement thicknesses.",56,1
34,https://doi.org/10.2514/1.J055663,,56,1
35,https://doi.org/10.2514/1.J056160,,56,1
36,https://doi.org/10.2514/1.J055743,,56,1
37,https://doi.org/10.2514/1.J056619,,56,1
