,doi,abstract,volume,issue
0,https://doi.org/10.2514/1.J057003,,56,1
1,https://doi.org/10.2514/1.J056788,,56,1
2,https://doi.org/10.2514/1.J055360,"An optical tracking facility was used to record the free flight of the Monarch butterfly for a large number of sequential flaps. The system automatically tracked reflective markers, which were modified to reduce the effects of additional mass on the flight characteristics. Measurements were analyzed over 75 flights of 9 butterflies in a climbing trajectory covering a large range of climbing rates. The flapping frequency remained fairly constant at 9.8 Hz. The peak-to-peak flapping amplitude varied more significantly with an average of 246.4°. The phase offset between flapping and body undulation averaged 89°. The body oscillation amplitude was 4.9 mm. Simulations using Theodorsen’s equation coupled with a single mass dynamics equation resulted in a body motion that closely agreed with the observed data. The undulation amplitude increased with the flapping amplitude, but decreased with wing loading. Butterflies have the lowest wing loading among insects, consistent with their large body undulation amplitudes. The wing–body phase offset solely depends on the reduced frequency, a consequence of the timing between the noncirculatory and circulatory forces. These results suggest that this novel experimental framework can increase our understanding of biological flight and development of micro flapping robots.",56,1
3,https://doi.org/10.2514/1.J055739,"The effects of stroke deviation of a flapping model insect wing on its aerodynamic force production are studied by solving the Navier–Stokes equations. Stroke deviation of a flapping wing often takes the forms of various out-of-plane wing-tip trajectories that depend on the time variation of the stroke deviation angle. In the present paper, four typical wing-tip trajectories, referred to as cases A–D, were used to investigate the effect of stroke deviation by comparing the aerodynamic forces, flows, and power requirements of the flapping wings with and without stroke deviation. The stroke deviation has remarkable influences on the time course of the aerodynamic force of a flapping wing. The influences could be explained by two mechanisms: one is the added-rotation effect, which is introduced by the deviation angle of the wing; the other is the change in effective angle of attack of the wing, which is due to the angular speed of the deviation. In general, the stroke deviation only produces a small effect on the cycle-mean aerodynamic forces, because the changes due to stroke deviation could be roughly offset in a wingbeat cycle. The analysis of power requirements shows that stroke deviation will generally lead to an increase in energy consumption for insect flights, indicating that insects should have the tendency to maintain the flapping motion in a plane for hovering or low-speed flight, as is observed in nature.",56,1
4,https://doi.org/10.2514/1.J056048,"Airfoil stall at low Reynolds numbers is a complex nonlinear dynamic phenomenon, which is characterized by catastrophe and hysteresis. It is difficult but important to mathematically describe the stall points under different Reynolds numbers. In this paper, taking the clockwise hysteresis as an example, a modeling method is proposed to describe the boundary of static airfoil stall according to the topological properties and physical characteristics of airfoil stall. Through numerical simulations, the lift characteristics of an airfoil at different Reynolds numbers are computed, and it is found that Reynolds number can affect not only the catastrophe and hysteresis of airfoil stall, but also the size of the hysteresis loop. Next, the static stall at low Reynolds numbers and the dynamic behavior described by the cusp-catastrophic model are proved to have a similarity in spatial topology and physical properties. According to the topological invariant rules, the topological-mapping relationship between the catastrophe-point set of the cusp-catastrophic model and the stall points of the airfoil stall is established through the development of an accurate topological-transformation function. Consequently, the catastrophe lines described by the cusp-catastrophic model can be used to represent the static-stall boundary of the airfoil at different Reynolds numbers. The effect of model description is verified by comparing the model-predicted values with the simulated values, and the error is found to be less than 1%.",56,1
5,https://doi.org/10.2514/1.J056108,"The onset of unsteady separation and dynamic stall vortex formation over a constant-rate pitching airfoil is analyzed by means of high-fidelity large-eddy simulations. The flowfields are computed by employing a previously developed and extensively validated high-fidelity implicit large-eddy simulation approach based on high-order compact schemes. A NACA 0012 airfoil section is considered at a freestream Mach number of and chord-based Reynolds numbers of . The wing is pitched about its quarter-chord axis at a nominally constant nondimensional rate of from a small initial incidence to an angle of attack beyond the onset of dynamic stall. The unsteady boundary-layer behavior that precedes the dynamic stall vortex formation is described in detail. It is found that the process is characterized by the presence of a laminar separation bubble that contracts with increasing angle of attack as leading-edge suction builds up. Beyond a critical incidence, the laminar separation bubble breaks down and rapid suction collapse ensues. Abrupt turbulent separation follows, allowing the turbulent boundary-layer vorticity to coalesce into a coherent dynamic stall vortex. The remaining turbulent boundary-layer vorticity rolls up into a shear-layer vortex that imparts a much weaker signature on the surface pressure. Maximum surface pressure fluctuations of very high frequency are observed near the leading edge just before laminar separation bubble bursting. The fluctuation level drops significantly as the shear layer moves away from the airfoil surface.",56,1
6,https://doi.org/10.2514/1.J055921,"An experimental investigation has been conducted to examine the influence of a single leading-edge protuberance on the performance of a baseline NACA airfoil. Static aerodynamic forces of the airfoils have been measured as the angle of attack increased and decreased. A hysteresis loop of the lift coefficient around the stall angle is observed for the baseline airfoil, with a sharp decline of the lift coefficient during angle-of-attack increase and a delayed recovery during angle-of-attack decrease. It was discovered for the first time that both the decline and the recovery of the lift coefficient of the modified airfoil with a single leading-edge protuberance included two steps. When the first step happened, the lift coefficient reached an intermediate value between the maximum value and the poststall value of the baseline airfoil, and it remained almost constant within a range of angles of attack. Surface tuft visualization revealed that, during the first step of stall, one side of the modified airfoil was stalled with leading-edge separation, whereas the other side remained in a nonstall condition. When the second step of stall happened, both sides of the modified airfoil were stalled, except for an attached flow on the protuberance peak. This one-sided stall phenomenon indicated that one important role of the leading-edge protuberance might be confining the local stall region from extending spanwise, which is similar to the effect of a wing fence.",56,1
7,https://doi.org/10.2514/1.J056071,"Dynamic stall is observed in numerous applications, including sharply maneuvering fixed-wing aircraft, biomimetics, wind turbines, and most notably, rotorcraft. The associated unsteady loading can lead to aerodynamic flutter and mechanical failure in the system. The present work explores the ability of nanosecond pulse-driven dielectric barrier discharge plasma actuators to control dynamic stall over a NACA 0015 airfoil. The Reynolds number, reduced frequency, and excitation Strouhal number were varied over large ranges: , , and , respectively. Surface pressure measurements were taken for each combination of Reynolds number, reduced frequency, and excitation Strouhal number. Phase-locked particle image velocimetry measurements were acquired for select cases. It was observed that the trends of effect of were similar for all combinations of Reynolds number and reduced frequency, and three major conclusions were drawn. First, it was observed that low Strouhal number excitation results in oscillatory aerodynamic loading in the stalled stage of dynamic stall. This oscillatory behavior was gradually reduced as increased and was not observed beyond . Second, all excitation resulted in earlier flow reattachment. Last, it was shown that excitation, especially at high , resulted in reduced aerodynamic hysteresis and dynamic stall vortex strength. The decrease in the strength of the dynamic stall vortex is achieved by the formation of large-scale structures induced by the excitation that bleed the leading-edge vorticity before the ejection of the dynamic stall vortex. At sufficiently high excitation Strouhal numbers , the dynamic stall vortex was completely suppressed.",56,1
8,https://doi.org/10.2514/1.J056099,"The effect of unsteady blowing through the leading edge on the flow structure over a 45 deg swept delta wing in relation to the steady blowing is experimentally studied in a low-speed wind tunnel using the techniques of surface-pressure measurements, particle image velocimetry, and laser-illuminated smoke visualization. The unsteady blowing in the form of a periodic square pattern at 25% duty cycle is provided at the excitation frequencies varying from 2 to 24 Hz for a fixed momentum coefficient. The flow structure is characterized at Reynolds number for the angles of attack varying from 7 to 20 deg. The results indicate that unsteady blowing through the leading edges of the planform is quite successful in elimination of localized separation from the surface of the planform. In comparison with the steady blowing, the periodic blowing at relatively higher excitation frequency induces substantial improvement in flowfield and demonstrates superior performance even at significantly lower total momentum.",56,1
9,https://doi.org/10.2514/1.J055796,"A parametric experimental study was performed with sweeping jet actuators (fluidic oscillators) to determine their effectiveness in controlling flow separation on an adverse pressure gradient ramp. Parameters that were investigated included actuator placement (that is, pitch and spreading angles, streamwise location) and actuator size. Microvortex generators were also used to provide a reference control case for comparisons. Surface pressure measurements and surface oilflow visualization were used to characterize the effects of these parameters on the actuator performance. Two-dimensional particle image velocimetry measurements of the flowfield over the ramp and hot-wire measurements of the actuator’s jet flow were also obtained for selective cases. The results suggest that an actuator with a wider jet spreading (110 versus 70 deg) placed closer (2.3 versus 7 boundary-layer thickness upstream) to the flow separation location provides better performance. Different actuator sizes obtained by scaling down the actuator geometry produced different jet spreading. Scaling down the actuator (based on the throat dimensions) from to resulted in similar flow control performance; however, scaling down the actuator further to reduced the actuator efficiency by reducing the jet spreading considerably. The results of this study provide insight that can be used to design and select the optimal sweeping jet actuator configuration for flow control applications.",56,1
10,https://doi.org/10.2514/1.J056255,"A numerical study is conducted to explore the unsteady nature of fluidic oscillators, which are responsible for generating sweeping jets for effective flow control of large-scale applications. Two- and three-dimensional unsteady Reynolds-averaged Navier–Stokes and three-dimensional improved delayed detached-eddy simulations are employed to simulate and resolve the flow structures in the internal flow passages of a fluidic oscillator and an external flowfield in a quiescent flow condition. The predicted flow generated by an enlarged actuator with an outlet diameter of 25 mm using air as a working fluid is validated against measurements at various supply rates. A comparison of current computational results using two-dimensional and three-dimensional unsteady Reynolds-averaged Navier–Stokes simulations with experiments indicates a reasonable agreement in the jet oscillation frequency. However, a significant discrepancy in the streamwise velocity field is observed between the two-dimensional unsteady Reynolds-averaged Navier–Stokes and experimental data. The three-dimensional unsteady Reynolds-averaged Navier–Stokes simulation also underpredicts the jet width, and consequently overpredicts the extension of the jet in the axial direction downstream of the actuator exit. Excellent agreement in the jet oscillation frequency and internal and external flowfields is obtained at two supply rates between the three-dimensional improved delayed detached-eddy simulation and the measurements. Simulations are also performed for a small-scaled actuator with a hydraulic outlet diameter of 1.3 mm, with water as the working fluid. The predicted oscillation frequency of the jet is compared with the experiments. A scaling analysis is also conducted by analyzing and correlating the flow characteristics and key parameters of the two actuators’ scales.",56,1
11,https://doi.org/10.2514/1.J056157,"Active unsteady flow control experiments were performed on a natural laminar flow airfoil at . The goal of this study was to control boundary-layer separation across the trailing-edge region of the airfoil in off-design conditions. Active control of separation was achieved using a series of blowing slots at the location. An adaptive closed-loop controller was developed based on the empirical mode decomposition algorithm. This controller was capable of automatically identifying the frequencies of natural instabilities in the flowfield, which were then used to set the driving frequencies of the flow control system. The airfoil performance with closed-loop frequency control was compared against a canonical open loop actuation. The differences in flowfield characteristics between these two cases were investigated in detail using particle image velocimetry measurements across the trailing-edge region of the airfoil. Closed-loop frequency control was observed to be associated with more effective alleviation of flow separation, having a shear layer closer to the surface of the airfoil in comparison with actuation. The empirical mode decomposition algorithm was also used to simultaneously perform closed-loop control of the actuation frequency and amplitude to achieve a desired value of .",56,1
12,https://doi.org/10.2514/1.J056088,"This paper is a continuation of the paper recently published by Hue et al. (“Experimental and Numerical Methods for Transition and Drag Predictions of Laminar Airfoils,” AIAA Journal, Vol. 53, No. 9, Sept. 2015, pp. 2694–2712) that focused on transition and drag predictions of laminar airfoils. The extension of such studies to three-dimensional configurations representative of modern civil aircraft is a further step toward the implementation of natural laminar-flow technologies. The present work, therefore, focuses on validating the laminar design of a low-swept wing for business jet applications. In 2015, an experimental campaign was carried out in the European Transonic Windtunnel, and included laminar/turbulent transition measurements with temperature-sensitive paint at Mach and Reynolds numbers typical of cruise flight conditions. Subsequently, fluid dynamics computations were performed on this aircraft geometry either with a Reynolds-averaged Navier–Stokes solver using both Tollmien–Schlichting and crossflow transition criteria, or with a boundary-layer code using either database methods for transition location or exact stability analyses. In this paper, experimental and numerical transition predictions are compared for three representative cases corresponding to different angles of attack. The agreement that is achieved is satisfactory, and extended regions of laminar flow are observed on the wing at cruise lift levels. In these conditions, the drag reduction can account for 10–15% of the aircraft drag.",56,1
13,https://doi.org/10.2514/1.J056167,"A transition transport model has been coupled with the SSG/LRR- differential Reynolds stress model to form a new transition and turbulence model containing nine transport equations. The aim is to handle complex turbulent flow together with wall-bounded transitional flow for industrial applications. Based on the difference between the Menter SST turbulence model and the SSG/LRR- model, special treatments are introduced for the length-scale determining equation of the turbulence model and the transition onset function of the intermittency transport equation of the transition model. The final transitional Reynolds stress model is calibrated based on zero-pressure-gradient flat plate flow. Additionally, a study on grid influences based on flat plate flow has been conducted. As a result, the presented model is able to predict transitional flows, including Tollmien-Schlichting transition, by-pass transition, and separation-induced transition, as well as considering complex turbulent flows. The model is validated for a number of test cases, including two-dimensional airfoils and the DLR prolate spheroid. The results are compared against transitional computations using the Langtry & Menter SST model and fully turbulent computations using the standard SSG/LRR- model. The comparisons show that the nine-equation transition model has equal or higher accuracy as the SST model for different types of flows.",56,1
14,https://doi.org/10.2514/1.J055900,"The current work reports on the results of high-accuracy two-dimensional and high-fidelity three-dimensional Navier–Stokes simulations of an SD7003 airfoil interacting with canonical upstream flow disturbances at low and moderate Reynolds numbers corresponding to laminar and transitional flow regimes. Three deterministic forms of upstream flow disturbances are considered, including sharp-edge gust, time-harmonic gust, and Taylor vortex models. The results obtained for the airfoil unsteady aerodynamic responses to gust perturbations with variable amplitude and duration are discussed in comparison with results from linearized inviscid incompressible unsteady aerodynamic theory to elucidate the importance of viscous effects in the considered flow regimes. Overall, the investigation reveals that the high-amplitude gust responses correlate well with inviscid theories, which is in contrast to the low-amplitude gust responses that appear to be strongly affected by viscous effects.",56,1
15,https://doi.org/10.2514/1.J056028,"An experiment investigating the nonlinear breakdown of hypersonic stationary crossflow waves has been conducted in a Mach 6 quiet tunnel. Secondary instabilities of the stationary waves were measured on a sharp, 7 deg half-angle cone at a 6 deg angle of attack, from 110 to 160 deg from the windward ray. A secondary instability was measured as it grew over a range of amplitudes until the onset of turbulence. The initial linear growth rate of the secondary instability was about , with a peak growth before breakdown of about from the sensor noise floor. At least two frequency bands of the secondary instability appeared to exist concurrently, with each spatially confined within a region of the stationary vortex. The instability wave speeds and frequencies were measured at several azimuthal locations. The wave group velocities were near the edge velocity, regardless of azimuthal location. The instability frequencies were between 140 and 300 kHz, and they generally decreased with the increasing azimuthal angle from the windward ray.",56,1
16,https://doi.org/10.2514/1.J056040,"Boundary-layer transition in hypersonic flows over a straight cone can be predicted using measured freestream spectra, receptivity, and threshold values for the wall-pressure fluctuations at the transition onset points. Simulations are performed for hypersonic boundary-layer flows over a 7 deg half-angle straight cone with varying bluntness at a freestream Mach number of 10. The steady and the unsteady flowfields are obtained by solving the two-dimensional Navier–Stokes equations in axisymmetric coordinates using a fifth-order-accurate weighted essentially nonoscillatory scheme for space discretization and using a third-order total-variation-diminishing Runge–Kutta scheme for time integration. The calculated factors at the transition onset location increase gradually with increasing unit Reynolds numbers for flow over a sharp cone and remain almost the same for flow over a blunt cone. The receptivity coefficient increases slightly with increasing unit Reynolds numbers. They are on the order of four for a sharp cone and are on the order of one for a blunt cone. The location of transition onset predicted from the simulation including the freestream spectrum, receptivity, and the linear and the weakly nonlinear evolutions yields a solution close to the measured onset location for the sharp cone. The simulations overpredict transition onset by about 20% for the blunt cone.",56,1
17,https://doi.org/10.2514/1.J056126,"A configuration of prismatic elements in boundary layers created by marching a surface triangulation on viscous walls along certain directions is a typical mesh for viscous-flow simulations. The quality of the resulting elements and the reliability of the meshing procedure thus highly depend on the computing strategy used to determine the marching directions. In this study, the authors propose to compute a field of marching directions governed by Laplacian equations. This new approach can ensure the smooth transition of marching directions, and thereby lead to more desirable element shapes. In addition, the possible intersections of boundary-layer elements growing from the opposite sides of a narrow region can be identified by analyzing the vector field. With respect to the solution of the governing equation, the boundary element method is preferred because of its advantageous solution accuracy. Because the boundary element method only needs a surface-triangulation input, there is no need to create a volume background mesh. Following the aforementioned idea, a new hybrid prismatic meshing method is developed, and the capability of the method is demonstrated by meshing experiments on models with complex geometries.",56,1
18,https://doi.org/10.2514/1.J056184,"In this study, an ice accretion method aimed at ice crystal icing in turbofan engines is developed and demonstrated for glaciated as well as mixed-phase icing conditions. The particle trajectories are computed by an Eulerian trajectory method. The effects of heat transfer and phase change on the particle trajectory and on the impact at the icing surface are taken into account. The computation of the evolution of the ice layer includes the contributions of ice and liquid water for mixed-phase conditions as well as the effects of erosion caused by ice crystals. Verification and validation benchmarks are carried out for a NACA 0012 airfoil and a streamlined shape with a curved cylindrical nose. It is shown that the ice thickness and shape are predicted accurately by the proposed method.",56,1
19,https://doi.org/10.2514/1.J055678,"Fixed point iteration is a common strategy to handle interdisciplinary coupling within a feedback-coupled multidisciplinary analysis. For each coupled analysis, this requires a large number of disciplinary high-fidelity simulations to resolve the interactions between different disciplines. When embedded within an uncertainty analysis loop (e.g., with Monte Carlo sampling over uncertain parameters), the number of high-fidelity disciplinary simulations quickly becomes prohibitive, because each sample requires a fixed point iteration and the uncertainty analysis typically involves thousands or even millions of samples. This paper develops a method for uncertainty quantification in feedback-coupled systems that leverage adaptive surrogates to reduce the number of cases for which fixed point iteration is needed. The multifidelity coupled uncertainty propagation method is an iterative process that uses surrogates for approximating the coupling variables and adaptive sampling strategies to refine the surrogates. The adaptive sampling strategies explored in this work are residual error, information gain, and weighted information gain. The surrogate models are adapted in a way that does not compromise the accuracy of the uncertainty analysis relative to the original coupled high-fidelity problem as shown through a rigorous convergence analysis.",56,1
