,doi,abstract,volume,issue
19,https://doi.org/10.2514/1.J056761,"Experiments were carried out on a scaled model of scramjet engine with gaseous hydrogen as a fuel in a 1 m combustion-driven shock tunnel. The simulated enthalpy was , at a freestream Mach number of 6.8 with varying stagnation pressures (110–190 bar), dynamic pressures (72–130 kPa), and equivalence ratio (0.24–1.16). Detailed studies were carried out to tailor the shock tunnel. Experiments were carried out with air and as the test gases with hydrogen injection to bring out the difference between reactive and nonreactive cases. Pressure measurement along the centerline of the engine and heat flux (through temperature measurements) inside the combustor was carried. The occurrence of supersonic combustion was ascertained through pressure measurements where no upstream influence was seen ahead of the strut injector and the same was corroborated by heat flux measurements. The pressure rise due to supersonic combustion downstream of the fuel injection was nearly three times as compared with nonreactive case. For the current case, when the combustor inlet pressure exceeds 1 bar, a sharp rise in the pressure signature was observed downstream of fuel injection, whereas no such marked trace was seen when is below 1 bar.",56,9
20,https://doi.org/10.2514/1.J056572,"This study focuses on the development of time-marching procedures for efficient and accurate fluid-thermal-structural analysis with time-accurate computational fluid dynamics. The developed procedures are based on a loosely coupled, partitioned framework for the fluid, thermal, and structural solvers—each with different second-order time integrators. The procedures also implement subcycling, where disparate time scales between the solvers are leveraged to minimize communication between solvers. The first scheme uses a second-order predictor of fluid loads, along with second-order interpolations of structural and thermal solutions. The second scheme is an extension that adds a corrector step to the structural and thermal solvers. The two schemes are benchmarked against both a strongly coupled approach with subiterations and a basic loosely coupled approach that omits the use of predictors/correctors. The schemes are examined in the context of the aerothermoelastic response of a panel in high supersonic flow, and are found to maintain second-order time accuracy with and without subcycling. Furthermore the approaches compare favorably against a strongly coupled approach at significantly reduced computational times, with the predictor-corrector approach yielding speedups of 2–4 times. In comparison, a basic scheme can yield characteristically different behavior.",56,9
21,https://doi.org/10.2514/1.J056405,"This paper describes a methodology, called local decomposition method, which aims at building a surrogate model based on steady turbulent aerodynamic fields at multiple operating conditions. The various shapes taken by the aerodynamic fields due to the multiple operation conditions pose real challenges as well as the computational cost of the high-fidelity simulations. The developed strategy mitigates these issues by combining traditional surrogate models and machine learning. The central idea is to separate the solutions with a subsonic behavior from the transonic and high-gradient solutions. First, a shock sensor extracts a feature corresponding to the presence of discontinuities, easing the clustering of the simulations by an unsupervised learning algorithm. Second, a supervised learning algorithm divides the parameter space into subdomains, associated to different flow regimes. Local reduced-order models are built on each subdomain using proper orthogonal decomposition coupled with a multivariate interpolation tool. Finally, an improved resampling technique taking advantage of the subdomain decomposition minimizes the redundancy of sampling. The methodology is assessed on the turbulent two-dimensional flow around the RAE2822 transonic airfoil. It exhibits a significant improvement in terms of prediction accuracy for the developed strategy compared with the classical method of surrogate modeling.",56,9
22,https://doi.org/10.2514/1.J056881,"A novel shock instability analysis model named cell–shock–cell system is presented. Shock-related nonunique numerical solutions of the Euler equation are presented in this system, which indicates that this simple system keeps the essential characteristics of numerical shock instability. The stability analysis of this system was conducted, and some important results were obtained. Carbuncle phenomena were shown to originate from multidimensional instability of the upstream shock cell. The numerical shock instability essentially starts from the grid face perpendicular to the shock rather than the grid parallel to it. The analytical eigenvalue analysis of the linearized equations showed that inappropriate pressure dissipation of Riemann solver at the vertical transverse face of a shock was responsible for the carbuncle phenomena and shock instability. Based on the mechanism that was identified, a fundamental cure principle was proposed. These new findings can serve as a basis for understanding the numerical shock instabilities presented in one-dimensional Riemann-solver-based numerical schemes as well as in designing shock-stable schemes.",56,9
23,https://doi.org/10.2514/1.J056882,"In our study series, the first paper found that the negative pressure dissipation of density flux at the vertical transverse face of a shock leads to shock instability. Here, we present a general eliminating method derived by this mechanism. This method, named transverse pressure dissipation modification, explicitly adds additional flux dissipation at the vertical transverse face of a shock. The stability of the modified scheme was analyzed by a linear stability method, and completely negative values of maximum real part eigenvalues of the linearized system were realized, which indicates the effectiveness of this method. This method was verified and compared in detail with the existing elimination method for typical cases via structured/unstructured mesh and two-dimensional and three-dimensional configurations. Transverse pressure dissipation modification can be connected to any Riemann solver, and the combined scheme is numerically shock stable and contact preserving.",56,9
24,https://doi.org/10.2514/1.J056550,"Mesh generation for high-fidelity computational fluid dynamics simulations and aerodynamic shape optimization is a time-consuming task. Complex geometries can be accurately modeled using overset meshes, whereby multiple high-quality structured meshes corresponding to different aircraft components overlap to model the full aircraft configuration. However, from the standpoint of geometry manipulation, most methods operate on the entire geometry rather than on separate components, which diminishes the advantages of overset meshes. To address this issue, a geometry module is introduced that operates on individual components and automatically computes their intersections to update overset meshes during optimization. Reverse-mode automatic differentiation is applied to compute partial derivatives across this geometry module so that it fits into an optimization framework that uses a hybrid adjoint method (known as ADjoint) to efficiently compute gradients for a large number of design variables. By using these automatically updated meshes and the corresponding derivatives, the aerodynamic shape of the DLR-F6 geometry is optimized while allowing changes in the wing–fuselage intersection. Sixteen design variables control the fuselage shape, and 128 design variables determine the wing surface. Under transonic flight conditions, the optimization reduces drag by 15 counts (5%) as compared with the baseline design.",56,9
25,https://doi.org/10.2514/1.J056648,"Experimental testing and analytical modeling of ice impact and fragmentation at turbo fan engine inlet were conducted in this research. A rotor testing facility, Adverse Environment Rotor Test Stand (AERTS) Laboratory, was introduced to reproduce natural icing condition and representative ice shapes typically found on engine inlet guide vanes. A total of 42 cases from 14 different icing conditions were conducted and used for high-speed visualization of ice impact tests and model development. Ice particles were analyzed using image postprocessing techniques and correlated using statistical tools. A cut-off in size range for analysis was found necessary before applying an energy-statistical method for model development. A cut-off criterion that related to the fracture stress, strain rate, and fracture toughness was implemented and compared with existing literature. After applying size cut-off, a Rosin-Rammler distribution was fitted to obtain mass-weighted particle distribution. Cumulative distribution function (CDF) was first formulated with comparison to an existing correlation based on hailstone impact experiments. The AERTS prediction successfully matched with experimental measurements, whereas the hailstone correlation constantly overestimate the size distribution. In addition, a probabilistic distribution function (PDF) was used to categorize the postimpact size distribution. The particle cloud was segmented into three groups weighted by mass (16%, 68%, and 16%). This technique provides a simple categorization method of a complicated impact fragmentation process. Instead of simulating the fracturing physics, a group of particles with three categories of particle sizes can be used as initial condition for postimpact aerothermal simulations that can significantly simplify computational fluid dynamics modeling complexity. Overall, a total of 6.1% mean absolute deviation in predicting the mean of particle sizes was achieved for total of 42 test cases in this study.",56,9
26,https://doi.org/10.2514/1.J056806,"The existence of debonding defects in thermal barrier coatings is one of the key problems that result in the premature failure of blades. In this paper, a line heat-source scanning thermography method for locating the defects in blades with unpainted thermal barrier coatings is developed. Compared with planar specimens, uneven temperature distribution in the blade surface is an unavoidable problem when using a line heat source because the complex shape of the blade makes the heat absorbed nonuniform. This unevenness shields the thermal response features of the defects and disturbs the identification of the defects. The developed window-averaged carrier postprocessing algorithm can solve this problem to achieve nondestructive testing of debondings. Apart from inspecting defects, a projected infrared fringe method is developed to reconstruct the three-dimensional morphology of the blade surface by analyzing the relationship between the temperature fringes modulated by surface morphology and surface height. In addition, a new manufacturing technique of artificial debondings is proposed by filling a groove with ceramic hollow particles. Nondestructive testing experiments on a blade with artificial debondings show that the methods and technique developed here have the potential to locate the three-dimensional spatial position of debondings in a scanning process.",56,9
27,https://doi.org/10.2514/1.J057145,"In this work, an efficient nonlinear state-space reduced-order model (ROM) is introduced. The nonlinear state-space ROM consists of both linear terms and nonlinear terms, the former of which is obtained based on Volterra series theory and eigensystem realization algorithm method, whereas the latter is determined by an output error-minimization procedure. Two approaches are proposed to determine the training signal for identification of the nonlinear terms. Aeroelastic analysis of a weakened wall-mounted AGARD 445.6 wing is conducted and it is demonstrated that 1) the nonlinear state-space ROM can get more accurate unsteady aeroelastic response than traditional linear Volterra-based ROM with computational fluid dynamics coupling with computational structural dynamic as a reference method for comparison; 2) the nonlinear state-space ROM performs well in range of subsonic, transonic, and supersonic; and 3) the nonlinear state-space ROM can better characterize the nonlinear aeroelastic system than traditional linear Volterra-based ROM without the need of identifying second-order Volterra kernels, which thus can be easily applied to solve engineering problems for its concise form.",56,9
28,https://doi.org/10.2514/1.J056760,"Nonlinear reduced-order modeling approaches have been a promising tool for predicting the transonic aerodynamic and aeroelastic behaviors of aircraft structures. However, the accuracy of the approaches in predicting the transonic limit-cycle oscillations and aeroservoelastic behaviors needs to be further improved. For example, because of the complexity induced by the coupling among deflection of control surfaces, oscillating shock waves, structural vibration, and aerodynamic viscosity, it is difficult to adjust the system order and number of neurons of the Wiener-based reduced-order model. Moreover, the increasing of the system order may lead to overfitting. This paper presents a novel reduced-order aerodynamic modeling methodology based on the theory of nonlinear state-space identification. The accuracy of the method is demonstrated for predicting aerodynamic loads, limit-cycle oscillations, and frequency responses of aeroservoelastic systems at transonic flow conditions. Results are compared with full-order simulations solving the Reynolds-averaged Navier-Stokes equations.",56,9
29,https://doi.org/10.2514/1.J056924,"Focusing on the aeroelastic stability of heated flexible panel in shock-dominated flows with arbitrary shock impingement location condition, a systematic theoretical analysis model is established. The von-Karman large deflection theory is used to account for the geometrical nonlinearity. Local first-order piston theory is employed in the region before and after shock to estimate the aerodynamic pressure. The results show that the shock impingement location has a significant effect on the stability of the flexible panel. The change of the critical dynamic pressure (for which flutter onset occurs) is not a monotonic function of the shock impingement point from one endpoint to the other. Specifically, the nondimensional critical flutter dynamic pressure increases as the shock impingement points move from the left to the right in the middle region, and the value of the critical flutter dynamic pressure varies substantially as the shock is located near the boundary of the panel. The variation is larger for higher shock strength. For a large shock strength, panel can buckle (or diverge) rather than only flutter even without thermal stresses. The sensitivity of the panel dynamics to the shock impingement location may have interesting implications for the case of a moving incident shock.",56,9
30,https://doi.org/10.2514/1.J056927,"A dual optimization method for optimizing contact-aided compliant mechanism design parameters and their spatial distribution in a dynamic ornithopter wing structure for increased pitch agility is presented. This methodology separates the task into two separate optimization problems where, first, a computationally efficient rigid-body dynamics model is used to determine the optimal stiffness and spatial distribution of the compliant mechanisms and, second, a detailed compliant mechanism design is developed and optimized that achieves the desired nonlinear stiffness. A rigid-body mechanics model of the wing structure is used to find the location and stiffness of a contact-aided compliant mechanism that will induce the forward sweep passively by coupling lift loads to forward sweep. The forward-swept compliant mechanism is then developed and optimized to achieve the desirable coupling. The free-flight pitch agility of an ornithopter is shown to increase via sweeping the wings forward during downstroke. A free-flight experiment is performed, and the novel contact-aided compliant mechanism is shown to induce the desired forward sweep during downstroke.",56,9
31,https://doi.org/10.2514/1.J056942,"Typically, numerical or approximate methods are used for the free vibration analysis of axially loaded Euler–Bernoulli beams because the governing differential equation does not yield an exact solution, even for uniform beams. However, for certain polynomial variations of the mass and stiffness, there exists a fundamental closed-form solution to the fourth-order governing differential equation, which is used to design axially loaded, cantilever beams having a prespecified fundamental natural frequency. In the presence of uncertainty, this flexural stiffness is treated as a spatial random field. For several known probability distributions (normal, log-normal, Weibull, Gumbel, and exponential) of the natural frequencies, the corresponding distributions of this field are determined analytically. These analytical expressions can serve as benchmark solutions for different statistical simulation tools to find the probabilistic nature of the stiffness distribution for known probability distributions of the frequencies. The analytical solution corresponding to the normal distribution is further used to derive the coefficient of variation of the stiffness distribution for a rotating cantilever beam, which is further used as an example problem to optimize the beam profile to maximize the allowable tolerance during manufacturing. An example of such a beam with a rectangular cross section is provided. The effects of the length of the beam and the uniform rotation speed on the optimal beam profile are also studied.",56,9
32,https://doi.org/10.2514/1.J056857,"This paper investigates the microvibration induced by a pulse tube cryocooler mounting on a space camera, and it describes a full methodology and experimental verification to deal with microvibration predictions. A coupled transfer function matrix is introduced by improving the traditional disturbance model, which is apt to be more representative of the real boundary conditions. The coupled method corrects the microvibration input load by using force filters that depend on estimations of the interface accelerances. The impact of microvibration is predicted, based on transfer functions found from the modeled camera. A system-level microvibration test is performed to verify the predicted results. Dynamic coupling is shown to exist. After integrating the finite element analysis results with the optics design software, the performance of the optical system represented by the modulation transfer function is analyzed. The results show that the surface deformations caused by cooler microvibration are very small, which can be neglected compared with the rigid-body motion. This approach accurately predicts the microvibration and its influences, which provides a new way to analyze the microvibration of an optical load on spacecraft.",56,9
33,https://doi.org/10.2514/1.J056466,,56,9
34,https://doi.org/10.2514/1.J057022,,56,9
35,https://doi.org/10.2514/1.J056723,,56,9
36,https://doi.org/10.2514/1.J056681,,56,9
37,https://doi.org/10.2514/1.J057655,,56,9
