,doi,abstract,volume,issue
0,https://doi.org/10.2514/1.J057134,"The establishment of an internal flowfield inside a single water droplet subjected to shock-wave impact is numerically and theoretically investigated. The main focus is on the description of the droplet internal flow pattern, which is believed to be one of the dominant factors in initial droplet deformation. The droplet internal flow pattern holds steady for quite a long time after the incident shock passage, and a saddle point is observed for the first time. Accordingly, the saddle point inside the droplet flow is used as a characteristic point to describe the internal flow. Cases of different incident shock strengths are tested, and a theoretical prediction is proposed to delineate the correlation between the saddle point steady position and the strength of the incident shock wave. The numerical cases are found to be in good agreement with the prediction. The present study helps to complete the understanding of the overall droplet aerobreakup phenomenon.",56,9
1,https://doi.org/10.2514/1.J057293,"A novel inwardly off-center shearing jet-stirred reactor is proposed and examined computationally. The inwardly off-center shearing jet-stirred reactor is compared with two traditional jet-stirred reactor designs, the outward cross-injector jet-stirred reactor and the concentric inward and outward jet-stirred reactor. The results show that the present inwardly off-center shearing jet-stirred reactor has significant improvement in terms of mixture uniformity and residence time distribution. Numerical results show the distributions of residence time in the two traditional jet-stirred reactors are wide and long tailed because of the formation of large and stable vortices, and the corresponding mean residence time of the two classical jet-stirred reactors deviates from the theoretical value by about 20%, while the new inwardly off-center shearing jet-stirred reactor has a much narrower residence time distribution and reduces the deviation to 8%, mainly attributed to the smaller vortices generated by an optimized jet arrangement. Moreover, the new inwardly off-center shearing jet-stirred reactor provides a fully optic-accessible platform for kinetic studies of alternative and real jet fuels.",56,9
2,https://doi.org/10.2514/1.J056959,"The size of the vertical tail and rudder of a commercial aircraft is influenced by the requirement that the airplane must be controllable in the event of an engine failure. As a result, on twin-engine airplanes, it is typically larger than is required for lateral/directional stability and control under normal flight conditions. Despite the rarity of the need for this level of control, the airplane must carry this size vertical tail and rudder with it at all times. The primary impact of this is additional drag and weight that reduces the fuel efficiency of the airplane. Active flow control can be used to enhance the control authority of the rudder by mitigating flow separation on it at high rudder deflection and sideslip angles. This effect can be used to provide the required level of rudder control authority from a physically smaller vertical tail. As a result, fuel efficiency of the airplane may be increased due to the reduced size and drag of the smaller vertical tail throughout the operational envelope of the airplane. In April 2015, Boeing and NASA tested a pneumatic sweeping-jet-based active flow control system on the vertical tail of the modified Boeing 757 ecoDemonstrator. This test was the culmination of several years of development that included small-scale wind-tunnel testing, computational-fluid-dynamics simulations, a system-integration study, full-scale wind-tunnel testing, and the flight demonstration. The data from the flight test indicate that the flow control actuation may be able to provide an approximately 14% increase in side force at the maximum tested rudder deflection and at critical sideslip angles.",56,9
3,https://doi.org/10.2514/1.J056944,"Thermal active flow control has been developed to enhance the efficiency of active flow control systems. The actuation concept is derived from gas-dynamics principles, and it is based on thermal control of the air supply. It is shown that higher air supply temperatures result in reduced mass flow rate with no degradation in active flow control performance. A computational method has been used to systematically investigate the hot air supply approach for isolated blowing actuators and fluidic oscillators. Subsequently, the thermal control concept has been computationally evaluated for airplane applications. These include enhanced control authority of a vertical tail and an airplane high-lift system, confirming the trends observed from the gas-dynamics analysis with regard to reduced actuation input as a function of supply temperature. Further confirmation of the thermal actuation concept was experimentally obtained for a bench-top actuator and a vertical-tail model in a wind-tunnel setting. The paper introduces potential approaches for system integration associated with heated supply, while highlighting the benefit of using available high-temperature sources for active flow control.",56,9
4,https://doi.org/10.2514/1.J056783,"The susceptibility of wall-bounded and free shear flows to transitory, pulsed actuation having time scales that are significantly shorter than the flow’s characteristic convective time scale has been used for external and internal aerodynamic flow control. This approach, which exploits the disparity between the onset and relaxation time scales of the embedding flow response, requires brief, anharmonic high-impulse actuation that is difficult to achieve by conventional momentum-based electromechanical actuation. However, investigations over the past decade have demonstrated the utility of chemically based actuation in which controllable high-impulse jets are produced using small-scale combustion-powered actuation. The present paper comprises two parts. The beginning of the paper describes the development of this actuation technology. In the present implementation, high-speed pulsed actuation jets are engendered by the ignition of a mixture of gaseous fuel and air within a cubic-centimeter-scale combustion chamber. The dependence of the actuator’s performance and of the ensuing momentary actuation jet on the composition of the chemical species, the internal geometry, and the flow configuration are characterized using dynamic pressure measurements and flow measurements using particle image velocimetry. The latter part of the paper describes a few examples of aerodynamic flow control using combustion-based pulsed actuation for the mitigation of separated flows over external static and moving aerodynamic surfaces. A fundamental aspect of the receptivity to pulsed actuation is the disparity between the time scales of the attachment and relaxation processes such that a single actuation pulse having a characteristic time scale of 0.05 can lead to brief, partial collapse of the separated flow domain, coupled with a momentary increase in circulation on a time scale that is nearly 200 times longer; and that repetitive actuation results in sustained lift enhancement.",56,9
5,https://doi.org/10.2514/1.J056642,"Two active nozzle-injection assemblies integrated with high-frequency, resonance-enhanced microactuators have been developed and characterized in this paper. In design 1, four injection nozzles each diameter were integrated circumferentially to another 1 mm nozzle that provided pulsed flow. This actuation jet had a frequency of 13–21 kHz. Compressed injected through steady nozzles served as the mixing stream, and compressed generated the actuation jet. The second design flipped roles of injection nozzles mentioned in design 1. In this case, the actuation jets pulsed out through the four nozzles, and the steady jet flowed through the 1 mm nozzle. In both cases, the resonance-enhanced microactuators nozzle flow generated a strong compressible vortex in the shear layer of steadily injected fluid that entrained and grew downstream, enhancing microscale mixing of the injected fluid and nitrogen at very high speed and at a designated frequency. This paper discusses the design and characteristics of resonance-enhanced microactuators nozzles, a potential active injection scheme that can be used for efficient and controlled flow mixing in high-speed applications.",56,9
6,https://doi.org/10.2514/1.J056796,"The evolution of the primary vortex pair downstream of micro vortex generators placed in a supersonic stream is compared using a swirl center tracking technique, for standard, slotted, and split-ramp-type vortex generators. Evolution of vortex strength, determined using circulation, and distribution of vortices, determined using contours of helicity, are also compared. Results show that secondary vortices emerge stronger, and liftoff heights drop, with the introduction of slot (slotted micro vortex generator) or gaps (split-ramp micro vortex generator). Near-surface contours of axial velocity and integral properties of the boundary layer are then compared to evaluate the effects of the evolution of the vortical structures on the flowfield. Results shows that the split-ramp device results in the most energetic near-surface flow but the worst outgoing boundary-layer integral properties, whereas the slotted-ramp devices with taper fare well on both counts. The computations performed in this work involve supersonic flow past single micro vortex generators at Mach 2.5 and use an immersed-boundary method to render the control devices. The flow solver is suitable for high-speed turbulent flows and has been extensively validated in earlier works. The turbulence model used is Menter’s shear-stress transport version.",56,9
7,https://doi.org/10.2514/1.J057074,"Flight vehicles with pointed forebodies experience large side forces and yaw moments at high angles of incidence due to random surface imperfections. These adverse side forces and yaw moments are the results of asymmetric vortices on conical bodies. To better understand the underlying flow physics associated with slender cones at high angles of incidence, an experimental investigation was conducted on a conventionally machined and a highly polished cone at subsonic speeds. Measurements included force and moments and velocity field using particle image velocimetry. Force measurement results show that the side-force magnitude and its dependence on roll orientation can be significantly reduced by polishing the cone surface. The results indicate that the ratio of imperfection height to the local crossflow boundary-layer thickness is a pertinent parameter influencing the location and growth of vortices. The region of incipient boundary-layer separation was found to be very sensitive to the presence of surface imperfections. By judiciously selecting the size and location of surface imperfections, significant changes can be made to the entire flowfield. Simultaneous force and time-resolved velocity measurements elucidate that the vortex switching with roll orientation for a cone at a high angle of incidence is a gradual process.",56,9
8,https://doi.org/10.2514/1.J056589,"Riblets are one of the most interesting passive drag reduction techniques. They essentially consist of streamwise grooved surfaces. Despite interest in these devices, the literature does not offer numerical simulations of riblets in the presence of pressure gradient or more generally around complex aeronautical configurations because, due to their scale length (microns), direct simulations are unfeasible. In the present paper an accurate and efficient method for the numerical simulation of riblets around complex aeronautical configurations is proposed. Riblets are modeled by a proper wall boundary condition based on the slip length concept. Slip length concept has been used by many authors in different fields; in the present paper a relation between the slip length and riblet height valid also in nonlinear range of drag reduction curve is proposed for the first time. This new boundary condition has been implemented in a standard code solving the Reynolds averaged Navier–Stokes equations. Validation tests in subsonic and transonic flows are performed comparing the results with the available experimental data. The analysis provides an interesting insight into riblets performance in the presence of the pressure gradient. Drag reduction improvement evidenced in some experiments is still debated because it seems to contradict the fact that riblet effect is confined very near to the surface (i.e., it is a local effect) and an explanation was never proposed until now. The present analysis provides a first contribution to understand why riblet performance can improve in the case of airfoil flow.",56,9
9,https://doi.org/10.2514/1.J056666,"An empirical model of wall pressure spectra for adverse pressure gradient boundary layers is proposed. The effect of adverse pressure gradients on wall pressure spectra and the relationship between the boundary-layer parameters and the wall pressure are studied and demonstrated. A dataset for five experiments at four different test facilities, covering Reynolds number between and based on the boundary-layer momentum thickness, is selected to develop the new model. Goody’s model is served as the basis for the development. Predictions of the new model and comparisons with other published wall pressure spectral models for adverse pressure gradient boundary layers are made for the selected dataset. The new model shows good prediction accuracy for the selected dataset and a significant improvement compared to the other published models.",56,9
10,https://doi.org/10.2514/1.J056926,"Thermoacoustic instability is a plaguing problem encountered in many combustion systems. The large-amplitude acoustic oscillations, which are a noted aspect of this instability, can have a detrimental effect on the performance of the system; and they sometimes even cause lasting damage to the system components. The aim of this study is to estimate the amplitude of the limit-cycle oscillations observed during thermoacoustic instability corresponding to the axial acoustic modes using pressure measurements acquired during stable combustion. First, an equation is derived that describes the slow-varying amplitude of oscillations in certain reduced-order models of combustion systems involving vortex shedding. Subsequently, a procedure is detailed, wherein this equation is used in conjunction with the measured pressure time series and some information about the system to predict the instability amplitude. The estimation capability of this technique is then tested using acoustic pressure data obtained from laboratory-scale bluff-body and swirl-stabilized combustors. It is observed that the estimated amplitudes are in good agreement with actual values.",56,9
11,https://doi.org/10.2514/1.J056699,"A new theoretical model is established to study the breakup of a charged power-law liquid jet, which is moving in coaxial swirling air. The liquid non-Newtonian behavior is explained by the power-law model, which is assumed to be the leaky dielectric material in this paper. The corresponding dispersion relation about the radical electrical field is derived by linear analysis. Results show that when the air swirl is introduced, the changing trend of the unstable growth rate on the axisymmetric mode is the same as the nonaxisymmetric ones. It is noted that the air swirl is one of the factors that stabilize the power-law liquid jet. Moreover, the effects of the electric field and the Weber number on the jet instability are examined on the temporal mode. Especially, when the electrostatic force increases to a threshold value, the effect of the air swirl is almost negligible on the jet breakup. Finally, the difference can be revealed between the Newtonian and the non-Newtonian liquid jets by investigating the effect of the power-law index.",56,9
12,https://doi.org/10.2514/1.J056434,"An experimental investigation into the coupling behavior of screeching axisymmetric twin supersonic jets is presented. Acoustic measurements and schlieren photography are used to identify four distinct coupling modes over a wide range of pressure ratios and nozzle spacings. Nozzle spacing is found to have a significant effect on the selection of these modes as well as the transition between them. A discrete jump in the peak screech frequency is seen to accompany most but not all mode switches. Statistical analysis of schlieren photography provides evidence that the modes consist of two flapping (symmetric and antisymmetric) and two different helical oscillations. These coupling modes are shown to have a limited effect on the convection velocity of the large-scale structures within the jet, and as such, the characteristic length scales are investigated as a source of mode switching.",56,9
13,https://doi.org/10.2514/1.J057261,"In previous work, a new compressive-sensing-based method for ducted aeroengine fan noise tests was proposed. The current paper reports the details of the validated aeroengine fan noise test method and the wind-tunnel test results for the validation. The experimental setup consists of a uniform oncoming jet to simulate the oncoming flow experienced by the duct, a mode synthesizer to generate different modes of characteristic fan noise, and a sensor array to conduct mode detection in the presence of background flow with background noise interference. The main attention is primarily focused on the examination of the associated reconstruction accuracy and the probability of success for spinning mode detection with high background noise interference. The test results clearly show the potential capability of the proposed new fan mode detection method for aeroengine aeroacoustics tests in a practical testing facility.",56,9
14,https://doi.org/10.2514/1.J056491,"This paper presents a boundary-field integral formulation suitable for the prediction of noise scattered by moving bodies. Although based on the same flow modeling assumptions, linear formulations derived from velocity potential or pressure disturbance wave equations provide different predictions when the scatterer is not at rest. Indeed, the discrepancies reside in the different influence of the neglected nonlinear terms. Here, a velocity potential-based approach is developed by extracting the first-order contributions from the nonlinear terms. This yields a linearized boundary-field, frequency-domain formulation for the scattered potential that, extending the standard linear boundary integral approach, takes into account the effects of mean flow nonuniformity. The influence of the additional field contributions is examined for different scatterer velocities, with the aim of assessing the domain of validity of the fully linear formulation and the rate of growth of the field contributions with increase of velocity. Specifically, the numerical investigation concerns the noise scattered by a moving, nonlifting wing, when impinged by an acoustic disturbance generated by a co-moving point source.",56,9
15,https://doi.org/10.2514/1.J056646,"Tone noise from a rotor–stator system representing a turbofan is studied based on high-fidelity unsteady simulations. The baseline configuration of the NASA source-diagnostic-test geometry with the entire hard-wall nacelle is solved by using the unsteady Reynolds-averaged Navier–Stokes equations and the improved delayed detached-eddy simulation at approach and takeoff conditions. Following a paper by Shur et al. (“Unsteady Simulations of a Fan/Outlet-Guide-Vane System: Aerodynamics and Turbulence,” AIAA Journal, 2018), which focused on the simulation methodology for the turbulence treatment and the aerodynamics, this paper investigates noise-generation/propagation phenomena of the first and second blade-passing-frequency tones: The analyses include mode decomposition of the tone power levels, their comparison with the NASA source diagnostic test data, nonlinear propagation of rotor-locked tones in the inlet, and the unsteady response of the stator against the rotor viscous wakes. With a duct-mode-matching method, the improved delayed detached-eddy simulation can predict tone levels within 6 dB and usually less, except for the rotor-locked tones. Although both simulations capture nonlinear decay in the inlet, “identical blade” simulations are unable to redistribute the energy into multiple pure tones at the takeoff speed. In the viscous-wake/outlet-guide-vane interaction, unsteady stator responses computed by both simulations seem not to be in accordance with classical models; moreover, the unsteady Reynolds-averaged Navier–Stokes simulation can predict only cut-on tone levels due to the lack of turbulence contents.",56,9
16,https://doi.org/10.2514/1.J056492,"The spectrum of a hypersonic three-dimensional boundary layer at Mach 6 is investigated with linear stability theory. It is shown that the three-dimensional wave of Mode S of discrete spectrum can be excited by the slow acoustic wave of continuous spectrum near the leading edge, and Mode S can evolve into the unstable traveling wave of crossflow mode in the downstream region. Furthermore, the influences of freestream slow acoustic waves on the instability of the hypersonic three-dimensional boundary layer in the presence of stationary crossflow vortices are also studied. Specifically, the downstream evolutions of traveling crossflow waves stemming from slow acoustic waves inside the boundary layer distorted by stationary crossflow vortices are investigated through biglobal analysis. It is found that the traveling crossflow waves evolve to the low-frequency mode III when the hypersonic three-dimensional boundary-layer flow is distorted by stationary crossflow vortices. The growth rates of the traveling crossflow waves with low frequency are hindered due to the finite amplitude of the stationary crossflow vortices in the downstream region. However, the traveling crossflow waves with high frequency can be significantly amplified by stationary crossflow vortices. The mode shapes of the traveling crossflow waves with high frequency look similar to that of the secondary instability modes, indicating that the modes can extract the energy through the spanwsie shear or wall-normal shear of the modified basic state. It is concluded that the breakdown of stationary crossflow vortices can be triggered by the freestream slow acoustic waves.",56,9
17,https://doi.org/10.2514/1.J057015,"A thermoacoustic interpretation of Mack’s second-mode instability is proposed. It is demonstrated that the fundamental mechanism of second-mode wave growth in hypersonic boundary layers is consistent with standing-wave thermoacoustically driven instability. The resonant nature of such modes is sustained by an acoustic impedance well between the wall (infinite impedance) and near the sonic line (secondary peak in impedance). A Lagrangian approach is adopted to show that such resonant standing waves derive energy from the base flow through thermoacoustic Reynolds stress, which results from the divergence of acoustic power inside the impedance well, and thermodynamic work. This treatment does not represent a complete energy closure (due to the neglect of viscosity), but it does provide insight toward a fundamental energy source and the physical mechanisms governing Mack’s acoustic second mode.",56,9
18,https://doi.org/10.2514/1.J056953,"The aeroheating performance of hypersonic vehicles is usually significantly influenced by the chemical reaction processes. For the new-generation hypersonic cruise vehicles, the boundary-layer flow is shown to be in chemical nonequilibrium due to rarefied gas effects. As a result, there will be a competition between the homogeneous recombination of atoms in the near-wall flowfield and the heterogeneous recombination on the catalytic wall surface, which, leading to a coupling of the heat diffusion and conduction, is beyond the application scope of the classical theories developed originally for the traditional blunt reentry vehicles. In this paper, the theoretical modeling and the direct simulation Monte Carlo method are employed to study the corresponding rarefied nonequilibrium flow and heat transfer phenomena near the sharp leading edges. A generalized model is proposed to evaluate the deviation of the actual aeroheating performance from the classical description. Based on this model, an integrated nonequilibrium criterion and a simple but effective bridging function are introduced to predict the stagnation-point heat transfer under the competitive effects between the homogeneous and heterogeneous recombination of atoms. The analytical formula is validated by the numerical results under various flow conditions.",56,9
