,doi,abstract,volume,issue
0,https://doi.org/10.2514/1.J058102,"In this paper, a new concept of a gripper pin structure is proposed for an aircraft morphing wing that can decouple in-plane stiffness from out-of-plane stiffness. There has been a pressing need for morphing wing skin structures that hold both low in-plane and high out-of-plane stiffness. A design methodology for the gripper pin morphing wing skin is presented here. The torsional and bending resistance mechanisms of the wing skin are presented to demonstrate its performance. The performance of the gripper pin wing skin under the variable camber compliant wing morphing process was estimated using 3D finite element models. According to the 3D finite element analyses, the stress levels of the gripper pin skin are much lower than that of the bulk material skin. The gripper pin wing skin structure has an enormous advantage with regard to the stress level and given its low actuation energy.",57,5
1,https://doi.org/10.2514/1.J057156,"Femtosecond laser tagging is demonstrated for the first time in R134a (1,1,1,2-tetrafluoroethane) gas and in mixtures of R134a with small quantities of air. A systematic study of this tagging method is explored through the adjustment of gas pressure, mixture ratio, and laser properties. It is found that the signal strength and lifetime are greatest at low pressures for excitation at both the 400 and 800 nm laser wavelengths. The relative intensities of two spectral peaks in the near-UV emission change as a function of gas pressure and can potentially be used for local pressure measurements. Single-shot precision in pure R134a is demonstrated in quiescent gas. One standard deviation (68%) of the uncertainty lies within of the mean velocity in a 0.1 atm pressure quiescent flow using a delay time of and within using a delay of . The variable parameter space is chosen to mimic conditions used in NASA Langley Research Center’s Transonic Dynamics Tunnel. Good signal-to-noise ratio is achieved for low-pressure conditions, especially in a pure freon environment. The precision and signal lifetime demonstrate the feasibility of using this technique for measuring representative Transonic Dynamics Tunnel flowfields in a bench-top laboratory setting.",57,5
2,https://doi.org/10.2514/1.J057449,"Time histories of pressure fluctuations on a generic, “hammerhead” launch vehicle model were measured using unsteady pressure-sensitive paint over a Mach number range of . The calibration process, using a set of unsteady pressure sensors, was found to overcome some of the inherent problems of the fast-response paint, such as rapid photodegradation, nonlinearity in pressure response, and significant temperature sensitivity. The large data set exposed various critical transonic flow physics such as a coupling of the shock motion on the payload fairing (PF) with the separated flow region downstream, and an upstream convection of pressure fluctuations on the PF at certain Mach numbers. Area-weighted integration of the pressure fluctuation data provided a measure of the unsteady forces on various parts of the model. The unsteady force coefficients on the PF and the upper stage were the highest when transonic shocks were present and found to reduce significantly when supersonic flow set in. Time histories on a dense, regularly spaced, spatial grid points allowed for the calculation of wavenumber–frequency spectra via Fourier transform. The spectra were dominated by the convected fluctuations; the acoustic domain was not discernible. These data, valuable for the buffet and vibroacoustics analysis of aerospace vehicles, are believed to be the first obtained for the transonic flight regime.",57,5
3,https://doi.org/10.2514/1.J057357,"The base flow of an axisymmetric generic space launcher model is investigated experimentally by means of particle image velocimetry and dynamic pressure measurements at a Mach number of 0.76 and a Reynolds number of , based on the main body diameter. The flow separation at the end of the main body forms a highly dynamic recirculation region with strong pressure fluctuations on the reattaching surface. The time-averaged reattachment on the rear sting is at 1.05 main body diameters downstream of the step. This work investigates the application of passive flow control devices for their potential of reducing the loads on the space launcher’s nozzle. It is shown that rectangular or circular grooves at the end of the main body force enhanced mixing in the separated shear layer, leading to a reduction of the reattachment length of 55%. Additionally, the fluctuations of the reattachment are significantly reduced, which results in lower-pressure fluctuations and thus reduced dynamic loads.",57,5
4,https://doi.org/10.2514/1.J057796,"The results of experiments investigating excitation of flow instability over a VR-7 airfoil at a post-stall angle of attack of 19° are presented. The Reynolds number based on the chord was fixed at , corresponding to a freestream velocity of . A single nanosecond dielectric barrier discharge (NS-DBD) plasma actuator was mounted near the leading edge of the airfoil. Natural vortex shedding was measured to be at a Strouhal number of 0.60. Excitation at low Strouhal numbers resulted in organized, large-scale, coherent structures in the shear layer over the separated region with shedding Strouhal numbers of . Cyclic formation and convection of these structures along the chord of the airfoil and entrainment of high-momentum freestream fluid into the separated zone resulted in periodic flow separation and reattachment and a nearly time-averaged chordwise spatially uniform increase in suction. In contrast, excitation at higher Strouhal numbers resulted in smaller, less-coherent structures in the shear layer that quickly developed over the airfoil and disintegrated. These small-scale structures with high passage frequency are effective at entraining freestream air into the separated region, generating a significant suction peak near the leading edge, and reattaching the flow over nearly of the chord. In this case, the significant separation-line unsteadiness was absent, and the resultant unsteady loading is expected to be much smaller than that of the low-Strouhal-number excitation cases.",57,5
5,https://doi.org/10.2514/1.J057804,"A tremendous number of gust-load cases need to be computed during the aircraft design and certification process. From an aerodynamic point of view, gust-load predictions in industry rely on linear potential flow methods, which are inappropriate at transonic flight conditions. Prediction accuracy can be enhanced by accounting for aerodynamic loads computed with computational fluid dynamics, eventually resulting in lighter, more efficient designs. However, full-order, unsteady time-marching simulations are still prohibitively expensive in an industrial environment. Therefore, different reduced-order modeling techniques have been proposed to decrease the computational cost. This paper focuses on an unsteady nonlinear reduced-order model based on least-squares residual minimization and a comparison to the linearized frequency-domain method. Although the latter is in line with current industrial practice of sampling aerodynamic forces in the frequency domain, it neglects dynamic nonlinearities, which are included in the former approach. Results are presented for an airfoil and the NASA Common Research Model at transonic flow conditions exhibiting shock-induced separation during the airframe–gust interaction. Essential quantities for the gust-load analysis, such as global coefficients, sectional forces, and distributed quantities, are evaluated and compared to highlight the strengths and weaknesses of both model reduction techniques.",57,5
6,https://doi.org/10.2514/1.J057629,"Double shock diamonds establish in the exhaust of modular convergent–divergent nozzles. These consist of two shock structures: one originating from the nozzle throat, and another from its exit. Analyzing the shock pattern developing for different fluidic injection operating conditions, it is shown that fluidic injection allows the rearrangement of the shock structures relative to each other. Overlapping the two structures causes large pressure oscillations in the exhaust and high amplitudes of shock associated noise, whereas staggering the shock structures mitigates these effects. The screech tone frequency does not change for all injection operating configurations, although the shock diamonds are shifted drastically with respect to each other. Hence, the screech phenomenon is dominated by the primary shock spacing originating from the nozzle throat.",57,5
7,https://doi.org/10.2514/1.J057982,"The influence of temporal square-wave excitation on structural and mixing characteristics of an equidensity, gaseous jet in crossflow (JICF) was explored in the present study. As in separate unforced and sinusoidally excited JICF experiments, acetone planar laser-induced fluorescence imaging enabled this detailed quantification for the JICF for mean jet-to-crossflow momentum flux ratios ranging from (with a convective unstable upstream shear layer, or USL, in the absence of forcing) to (with a globally unstable USL). Such square-wave excitation of the jet fluid required adaptive feedforward control, not only to create more accurate temporal square waveforms but to enable more accurate comparison among alternative forcing conditions. Square-wave excitation of the JICF demonstrated a significant influence on the naturally globally unstable JICF, where specific nondimensional stroke ratios within -dependent ranges could produce deeply penetrating, periodic vortices with improved jet penetration and spread. Enhanced jet penetration did not always correlate with better molecular mixing, however; there was a stronger correlation of improved mixing at higher values with creation of a more symmetric jet cross section via square-wave excitation, especially one with a clear counter-rotating vortex pair structure.",57,5
8,https://doi.org/10.2514/1.J057612,"The evolution of the shear-layer flowfield of a round transient turbulent jet is analytically investigated within the near-field of the jet over which the velocity potential core decays. The model results are verified and expanded by performing a large-eddy simulation of the suddenly started jet. Unlike quasi-steady approaches, the present work aims at solving the momentum conservation while preserving the time-dependent term. The governing equation is integrated with a mixing-length model to account for the turbulent mixing in the shear layer. The solution is asymptotically applicable to the shear layer of the circular jet and excludes the head vortex mixing. A reasoned calibration of the model parameters for moderate Reynolds numbers results in acceptable agreement for the streamwise entrainment both with experimental data and with large-eddy simulations. The validity limit of the present model is examined by outlining the characteristic length of the velocity potential core as well as the restricting effects of the jet dynamics on the founding assumptions of the model. The study will be instrumental in developing a hot-jet ignition model in which the rate of mass entrainment into the jet influences the prediction of ignition based on the temperature and species distribution.",57,5
9,https://doi.org/10.2514/1.J057476,"An experimental study of the azimuthal modes of the sound field generated by a single-stream round jet installed near a flat plate is presented. The investigation is conducted at subsonic Mach numbers (up to 0.82) for the configuration in which the plate trailing edge is located in the linear hydrodynamic jet near field. It is shown that the azimuthal modes of the acoustic field contain additional information compared to the total signals and allow more precise characterization of the installation effect in the low-frequency domain where it is most pronounced. The factors influencing the accuracy of the azimuthal decomposition are considered. It is demonstrated that jet noise remains practically unaffected by the plate and that installation noise is localized in the azimuthal modes antisymmetric with respect to the plate. A novel procedure of splitting total noise into jet noise and installation noise components is proposed. It is shown that this procedure allows more precise determination of the installation noise parameters, which are shown to correspond to the analytical model based on the scattering of the jet near-field pulsations by a half-plane. Correlation properties of the azimuthal modes in the installed and uninstalled configurations are also investigated and analyzed.",57,5
10,https://doi.org/10.2514/1.J057086,"Measurements and predictions of far-field sound radiated by rounded forward-facing steps immersed in an incompressible turbulent boundary were performed. Four different corner rounding radii equal to 0%, 6.25%, 12.5%, and 25% of the step height were considered. The step height was 26.2% of the incoming boundary-layer thickness and the Reynolds number based on step height ranged between 35,000 and 104,000. Measurements of the spanwise averaged unsteady pressure show that the pressure on the downstream surface is a function of rounding due to change in the size and strength of the separation bubble, whereas on vertical face it remains independent of corner rounding. The pressure on either surface scales on the step height and free-stream velocity. Rounding the step corner leads to a consistent reduction in noise without changing the overall shape of the sound spectrum significantly. The sound from each rounded step exhibits the effects of step noncompactness, which prevents spectral scaling. The predictions of sound from an unrounded forward-facing step were made by combining a theoretical formulation with surface pressure measurements. The predictions describe the overall shape of the sound spectrum including the effects of step noncompactness accurately.",57,5
11,https://doi.org/10.2514/1.J057723,"The problem of propagation of sound across the shear layer in a turbofan jet exhaust with an external centerbody is discussed. The wave equation of interest is the compressible Rayleigh equation. Two forms of the equation are considered, and the Green’s function solutions, subject to appropriate surface conditions on the centerbody and flight condition in the ambient, are presented. Directivity studies in a heated exhaust at temperature ratio of 2.0 and Mach number 0.90 indicate that a rigid centerbody tends to increase the sound propagation at forward angles relative to an exhaust without a centerbody, whereas application of suitable surface liner may significantly reduce this enhancement.",57,5
12,https://doi.org/10.2514/1.J057531,"In this work, scattering and shielding of the tonal noise from contrarotating open rotors by surrounding parts are investigated. The computational tool chain is based on unsteady Reynolds-averaged Navier–Stokes simulations providing permeable integration surface data for a Ffowcs Williams and Hawkings-type evaluation (“Sound Generated by Turbulence and Surfaces in Arbitrary Motion,” Philosophical Transactions of the Royal Society of London, Series A: Mathematical and Physical Sciences, Vol. 264, No. 1151, 1969, pp. 321–342), which is coupled with a fast multipole boundary-element method to account for shielding by the airframe. The effect of a background mean flow is taken into account by applying a Lorentz transform to the boundary-element problem and using the Möhring analogy instead of the Ffowcs Williams and Hawkings formulation to obtain the incident acoustic field. Validation of the Möhring/boundary-element coupling method is shown on the basis of a model contrarotating open rotor with shielding geometries and a mounting pylon. The tool chain is then applied to a full-scale open-rotor engine installed in different aircraft tail configurations (T tail, L tail, and U tail) to assess their influence on flyover and lateral noise in takeoff conditions.",57,5
13,https://doi.org/10.2514/1.J057714,"Volumetric measurements of the flow within four cavities were made by scanning stereoscopic particle image velocimetry at a freestream Mach number of 0.8. The cavities have a length-to-depth ratio , and a width-to-length ratio . Three complex cavity geometries are used to model features representative of real aircraft bays and compare them to a simple rectangular cavity. The rectangular configuration exhibits signs of a transitional cavity regime, with resonant tones that compare well with predicted Rossiter values. The addition of a leading-edge ramp lofts the cavity mixing layer and accelerates the cavity freestream, resulting in reduced Rossiter amplitudes and increased frequencies. Side-wall spillage vortices are present in the rectangular cavity but are not found after the addition of side ramps that lessen the pressure gradient forming them. A center scoop causes a spanwise variation of velocity characteristics within the flowfield. Finally, a jagged leading edge attached to the scooped case results in reduced velocity fluctuations with an increased Rossiter mode-2 amplitude.",57,5
14,https://doi.org/10.2514/1.J057850,"Wall-resolved implicit large-eddy simulations based on spatial filtering are performed for shock-induced flow separation over an axisymmetric bump at a Mach number of 0.875 and a chord-based Reynolds number of 2.763 million. The incoming boundary layer has a momentum thickness Reynolds number of 6600 at 1.5 chords upstream of the bump. The calculations, which employ up to 24 billion grid points, simulate the experimental model of Bachalo and Johnson (“Transonic, Turbulent Boundary-Layer Separation Generated on an Axisymmetric Flow Model,” AIAA Journal, Vol. 24, No. 3, 1986, pp. 437–443), except that the tunnel walls are ignored and free air is assumed. The effects of domain span and grid resolution are examined along with main flowfield features. The predicted shock position as well as separation and reattachment locations agree well with experiment. Grid convergence is observed in the attached region well upstream of separation. Two-point azimuthal correlations suggest that a span of at least 20 deg is needed in the attached region, whereas a 120 deg span appears insufficient for correlations to completely decay to zero by midspan in the separation/reattachment region. Computed rms surface pressure fluctuations display a sharp primary peak at the shock foot and a broader secondary peak near the reattachment location. Simulations reveal evidence of low-frequency shock unsteadiness; however, a longer statistical sample is needed to investigate this phenomenon.",57,5
15,https://doi.org/10.2514/1.J057302,Transonic aeroelasticity is an important consideration in the conceptual design of next-generation aircraft configurations. This paper develops a low-order physics-based flutter model for swept high-aspect-ratio wings. The approach builds upon a previously developed flutter model that uses the flowfield’s lowest moments of vorticity and volume-source density perturbations as its states. The contribution of this paper is a new formulation of the model for swept high-aspect-ratio wings. The aerodynamic model is calibrated using offline two-dimensional unsteady transonic computational-fluid-dynamics simulations. Combining that aerodynamic model with a beam model results in a low-dimensional overall aeroelastic system. The low computational cost of the model permits its incorporation in a conceptual design tool for next-generation transport aircraft. The model’s capabilities are demonstrated by finding transonic flutter boundaries for different clamped-wing configurations and investigating the influence of transonic flutter on the planform design of next-generation transport aircraft.,57,5
16,https://doi.org/10.2514/1.J057805,"The classic linear Heaslet–Lomax problem, which is concerned with the indicial response of a supersonic airfoil experiencing a sudden small step motion, was recently extended to nonlinear cases where the sudden step motion is of high amplitude or equivalently a high angle of attack is suddenly achieved. Here in this paper, the more practical case of starting flow is considered where the high angle of attack is achieved through an accelerated sinking movement over a finite time interval. The problem is classified into fast sinking motion, middle-speed sinking motion, and slow sinking motion, for which the flow and force evolution exhibit different behaviors. The acceleration is shown to generate unsteady pressure waves that feed the major shock wave and expansions wave. A nonlinear indicial approach based on application of weighted Duhamel superposition principle to nonlinear starting flow model is built. This nonlinear model is shown to compare well with computational fluid dynamics simulation. The physics related to various stages of force evolution is discussed.",57,5
17,https://doi.org/10.2514/1.J056750,"The principal goal of the Hypersonic International Flight Research Experimentation (HIFiRE) flight 5 is to measure hypersonic boundary-layer transition on a three-dimensional body. This paper presents measurements of heat flux and boundary-layer transition in the Boeing/U.S. Air Force Office of Scientific Research Mach-6 Quiet Tunnel. This facility has been developed to provide quiet flow at high Reynolds number, with low noise levels comparable to flight. Previously, the global heat flux and location of the transition front were measured with temperature-sensitive paint (TSP). A new HIFiRE-5 model was built with a polyether ether ketone shell, which is suitable for infrared–thermographic heat-flux measurements. Quiet-flow tests at Reynolds numbers of and zero angle of attack indicate a centerline transition location within 4% of the earlier TSP results, on the order of the uncertainty of the two techniques. This good agreement reinforces confidence in the earlier measurements and the new infrared-based technique. Examination of the off-centerline transition front indicates that the wavelength of stationary crossflow vortices is the same for both models and instrumentation techniques, although the streaks do not coincide precisely.",57,5
18,https://doi.org/10.2514/1.J057283,"A proper understanding of the intake starting process of supersonic airbreathing engines is crucial for a successful operation of the supersonic aircraft, especially for three-dimensional geometries in which no reliable starting prediction for a broad Mach number range exists, and the widespread Kantrowitz criterion only provides a conservative prediction. Experimental investigations from the literature are reviewed and put into the perspective of the Kantrowitz theory. First, an empirical relation is developed that is valid for a wide Mach number range, and that can be calibrated to certain classes of intakes by the user. Second, the Kantrowitz assumptions are modified and a semiempirical relation is derived. The semiempirical relation turned out to be an optimistic limit for self-starting.",57,5
19,https://doi.org/10.2514/1.J057961,"Profound importance has been attached to aero-optical effects on distortion of optical signals and image aberration for imaging guidance aircraft to eliminate such detrimental impact with respect to the disciplinary intersection of fluid dynamics and optical engineering. Even though numerical simulation has become an irreplaceable technique in this field, few attempts focusing on method validation are reported, despite the widely existing simulative studies. Because of the urgent demand of such a validation task, the authors conduct a rigorous discussion on the effectiveness of a combinational WCNS-E-5 and ray-tracing method in aero-optical simulation. In section order, oblique shock wave, three-dimensional supersonic mixing layer, and subsonic commingled flow are employed for comparison with theoretical results, grid sensitivity analysis, and experimental data validation, respectively. Results suggest that grid independence of aero-optical parameters still holds, and reasonably prescribed inflow conditions may realize little difference between simulated optical path difference rms and measured data from the wind-tunnel test.",57,5
20,https://doi.org/10.2514/1.J057701,"The static-pressure field in the steady and compressible Navier–Stokes equations is decomposed into Euler (inviscid) and dissipative (viscous) partial-pressure fields as a generalization of the incompressible pressure decomposition previously reported by Schmitz and Coder (“Inviscid Circulatory-Pressure Field Derived from the Incompressible Navier–Stokes Equations,” AIAA Journal, Vol. 53, No. 1, 2015, pp. 33–41). The primary purpose of partial-pressure fields is to provide a means of dissecting local drag contributors over a lifting body. The analysis shows that the integral of the Euler pressure over the surface of a lifting body of thickness recovers the Kutta–Joukowski theorem for lift, and results in Maskell’s formula for the vortex-induced drag in the limit of high Reynolds number; the combined integral of the dissipative pressure and wall shear stress results in a generalized form of Oswatitsch’s formula for entropy-flux drag. Transport equations are derived with well-posed boundary conditions for both the Euler and dissipative partial-pressure fields for implementation in computational fluid dynamics codes as a complement to far-field and volumetric methods for drag decomposition of complex aircraft configurations.",57,5
