,doi,abstract,volume,issue
18,https://doi.org/10.2514/1.J059033,"This paper proposes a probabilistic framework for assessing the consistency of an experimental dataset, i.e., whether the stated experimental conditions are consistent with the measurements provided. In case the dataset is inconsistent, our framework allows one to hypothesize and test sources of inconsistencies. This is crucial in model validation efforts. The framework relies on Bayesian inference to estimate experimental settings deemed uncertain, from measurements deemed accurate. The quality of the inferred variables is gauged by its ability to reproduce held-out experimental measurements. The correctness of the framework is tested on three double-cone experiments conducted in the Calspan-University at Buffalo Research Center’s Large Energy National Shock Tunnel-I (LENS-I), which have also been numerically simulated successfully. Thereafter, the framework is used to investigate two double-cone experiments (executed in the LENS-XX), which have encountered difficulties when used in model validation exercises. An inconsistency is detected with one of the LENS-XX experiments. In addition, two causes are hypothesized for our inability to simulate LEXS-XX experiments accurately and are tested using our framework. It is found that there is no single cause that explains all the discrepancies between model predictions and experimental data, but different causes explain different discrepancies, to larger or smaller extent. This paper proposes that uncertainty quantification methods be used more widely to understand experiments and characterize facilities, and three different methods are cited to do so, the third of which is presented in this paper.",58,10
19,https://doi.org/10.2514/1.J059407,"An accurate boundary-layer transition prediction method integrated with computational fluid dynamics (CFD) solvers is pursued for hypersonic boundary-layer flows over slender hypersonic vehicles at flight conditions. The geometry and flow conditions are selected to match relevant trajectory locations from the ascent phase of the HIFiRE-1 flight experiment, namely, a 7 deg half-angle cone with 2.5 mm nose radius, freestream Mach numbers in the range of 3.8–5.5, and freestream unit Reynolds numbers in the range of . Earlier research had shown that the onset of transition during the Hypersonic International Flight Research Experimentation 1 (HIFiRE-1) flight experiment correlated with an amplification factor of for the planar Mack modes. However, to incorporate the -factor correlations into a CFD code, we investigate surrogate models for disturbance amplification that avoids the direct computation of stability characteristics. The results demonstrate that the application of the commonly used approach, which is based on a database of stability characteristics for locally similar profiles, leads to large, unacceptable errors in the predictions of amplification factors. We propose and demonstrate an alternate approach that employs the stability computations for a canonical set of blunt cone configurations to train a convolutional neural network model that is shown to provide substantially improved transition predictions. The excellent performance of the neural network model is also confirmed for cone configurations with nose radius and half-angle values outside of those used to build the database. Finally, the convolutional neural network model is found to outperform the linear stability calculations for underresolved basic states.",58,10
20,https://doi.org/10.2514/1.J059177,"This paper presents an experimental study of laminar-to-turbulent boundary-layer transition in a circular duct at high supersonic Mach number. The experiments were conducted as an essential precursor for scramjet drag reduction studies using a direct-connect scramjet combustor. The experiments were carried out at the University of Queensland T4 shock tunnel using a 33.2-mm-diam and 500-mm-long circular duct at flow stagnation enthalpies of 3.2 and . The experimental work was supported with two-dimensional and three-dimensional Reynolds-averaged Navier–Stokes simulations. Comparisons between numerical and experimental results show initial rise in heat transfer at the first shock-wave boundary-layer interaction, followed by an unsteady laminar region interspersed with possible turbulent spots. Heat transfer measurements along the wall that show sustained transition to turbulence did not occur within the full length of the duct. Transition to turbulence within the circular duct is significantly delayed when compared with estimations based on flat-plate results. These results indicate that there is value in revisiting the assumption of a fully turbulent boundary layer for previous semi-direct-connect scramjet combustion experiments that have used transition length correlations derived from flat-plate experiments within the same facility. The findings from this investigation have implications for conclusions drawn from experimental investigations of boundary-layer-combustion-induced drag reduction in circular ducts.",58,10
21,https://doi.org/10.2514/1.J059540,"Magnetohydrodynamic (MHD) aerobraking experiments were conducted in the large-scale X3 expansion tunnel at the University of Queensland. The test gas was argon flowing at approximately for a quasi-steady period of . A neodymium spherical permanent magnet, suspended by string and enclosed within a 65-mm-diameter spherical forebody, was used to generate the magnetic field. An accelerometer was attached to the rear of the magnet to measure streamwise motion, allowing the Lorentz force on the magnet to be deduced according to Newton’s second law. The stagnation point magnetic flux density was varied by changing the internal streamwise location of the magnet within the forebody. Experimental results demonstrate a linear increase in MHD drag with magnetic field strength, which is in agreement with previous results from arcjet facilities. However, the MHD drag force was much lower in these experiments, even after accounting for shock density ratio and viscosity differences. This discrepancy could be due to the different freestream state generated by the two types of facilities.",58,10
22,https://doi.org/10.2514/1.J059049,"This experimental study explored the influence of global/local flame behaviors on direct combustion noise produced by a lean-premixed gaseous low-swirl turbulent jet flame, with a focus on the mechanism resulting in characteristic peaks in combustion noise spectra. Ten kilohertz chemiluminescence and OH planar laser-induced fluorescence (OH-PLIF) imaging were used to study the spatiotemporal evolution of heat release and flame structure fluctuations, respectively, whereas 2-D particle image velocimetry (2-D PIV) measurements at 4 Hz were applied to study the mean-based relation between the velocity/vorticity fields and flame structures. Pressure and global heat release fluctuation measurements carried out alongside these optical diagnostics revealed pronounced double peaks in both combustion noise and global heat release fluctuation spectra at global equivalence ratios of . Spectral proper orthogonal decomposition of the chemiluminescence and OH-PLIF images revealed that the first peak in the noise spectra to be caused by flame oscillations over nearly the entire flame region, whereas the secondary peak was attributed to periodically generated vortical flame structures near the downstream side of the flame boundary. The 2-D PIV results suggest that vortical flame structures are likely generated by the interaction between the flame and the inner/outer shear layers.",58,10
23,https://doi.org/10.2514/1.J059576,"The effect of the eddy viscosity length scale on the accuracy of large-eddy simulation (LES) is investigated for several commonly used subgrid models. Multiple types of length scales are considered, both purely geometric length scales (including the cube root of the cell volume and the maximum cell dimension) and length scales that depend on both the grid and the flow. The assessment focuses on how the LES prediction changes for increasingly anisotropic grids in forced isotropic turbulence and channel flow at high Reynolds number. Although some length scales perform better than others, the main conclusion is that no single length scale produces LES results that are completely independent of the grid anisotropy. Because every model and length scale tested produces accurate results on at least one grid and inaccurate results on at least one other grid, the study shows clearly the need to assess LES models on multiple grids with multiple different anisotropy ratios.",58,10
24,https://doi.org/10.2514/1.J059185,"Overset meshes have a unique advantage in handling moving boundary problems as remeshing is often unnecessary. Recently, overset Cartesian and strand meshes were used successfully to compute complex flow over rotorcraft. Although it is quite straightforward to deploy a high-order finite difference method on the Cartesian mesh, the near-body solver for the strand mesh is often limited to second-order accuracy. In the present study, a high-order flux reconstruction solver, hpMusic, is developed on both the near-body and background grids, and it is extended to handle moving boundary problems. Accuracy studies are carried out, and the designed order of accuracy is obtained for both inviscid and viscous flows. The method is then tested for a benchmark dynamic airfoil problem from the 4th International Workshop on High-Order CFD Methods. Mesh and order-convergent results are obtained and compared with those from other groups. Finally flow over a hovering rotor is simulated to compare with experimental data. In this case, the present high-order solver is capable of generating and propagating tip vortices with high resolution. Good agreement is achieved with experimental data in tip vortex core size, location, and the swirl velocity at third-order accuracy.",58,10
25,https://doi.org/10.2514/1.J059434,"This paper shows that -degree-of-freedom generic unstable potential systems, whose potential matrices have an even number of negative eigenvalues and which are gyroscopically stabilized, can always be made exponentially stable through the use of an uncountably infinite number of indefinite damping matrices. A step-by-step methodology is provided for gyroscopic stabilization of such unstable potential systems that guarantees their exponential stability through the simultaneous use of positive and negative velocity feedback. Dissipative damping and positive velocity feedback are shown to constructively cooperate to bring about such stability. In contrast to the well-known Kelvin–Tait–Chetaev paradigm, which states that gyroscopically stabilized unstable potential systems are always made unstable in the presence of the slightest dissipation of energy, the paper points to a new paradigm, which states that the proper simultaneous dissipation and infusion of energy into generic gyroscopically stabilized unstable potential systems guarantees their exponential stability. What is meant by “generic” is explicitly stated, and such generic systems are shown to include most real-life -degree-of-freedom unstable potential systems.",58,10
26,https://doi.org/10.2514/1.J058976,"The stress and strain tensors in maneuvering aircraft are affected not only by the aerodynamic and propulsive forces but also by the body translational and angular velocities and high rate temperature distributions. The structural design of flexible aircraft requires the elastic fields to be evaluated at high accuracy. For this, new models that couple the aeroelasticity equations with the heat and translational and rotational equations of flight dynamics are essential. In this paper, the governing equations are derived by describing the motion of a thermoelastic body in an undeformed body frame by means of the variational principle applied to four invariants: the kinetic energy, the gravitational potential energy, the thermoelastic potential, and the dissipation function. Particular cases of longitudinal and lateral flight dynamics of a thermoelastic body including longitudinal flight of a thermoelastic beam are considered. Also, a discrete system for the translational and rotational velocities, the structural modes, and nodal temperature is derived. These equations may advance control design of hypersonic platforms, flexible aircraft, and missiles.",58,10
27,https://doi.org/10.2514/1.J059592,"Free vibrations of thick and skew quadrilateral laminates have been analyzed by using the Ritz method and a third-order shear and normal deformable plate theory (TSNDT) that does require a shear-correction factor. The weighted orthogonal Jacobi polynomials are employed as basis functions that exactly satisfy essential boundary conditions at the plate edges. An in-house-developed software is first verified by comparing computed frequencies with those either available in the literature or found by using the three-dimensional linear elasticity-theory-based finite-element-based commercial software ABAQUS. The method is applied first to find the lowest few (six in most examples) frequencies of isotropic cantilever plates of different skew angles and thickness-to-side length ratios. Subsequently, natural frequencies of laminated composite plates for various skew angles, thickness-to-side ratios, numbers of layers, and stacking sequences are compared with those obtained from converged solutions using either shell or brick elements in ABAQUS. It is demonstrated that the TSNDT/Ritz method provides highly accurate frequencies. Three-dimensional mode shapes are presented for a better understanding of the dynamic behavior of skew quadrilateral laminates.",58,10
28,https://doi.org/10.2514/1.J058685,,58,10
29,https://doi.org/10.2514/1.J059286,,58,10
30,https://doi.org/10.2514/1.J059093,,58,10
31,https://doi.org/10.2514/1.J059779,,58,10
32,https://doi.org/10.2514/1.J057342.c1,,58,10
