,doi,abstract,volume,issue
20,https://doi.org/10.2514/1.J058460,"A simplified formulation, based on treating the ratio of the heat release to the postshock thermal enthalpy as a small parameter, accommodating arbitrary chemistry descriptions, is shown to reproduce computationally the same variety of phenomena as more complex formulations for oblique detonations with supersonic postshock flow. The resulting small relative variations of velocity and thermodynamic properties across the reaction region are described by linearized Euler equations written in characteristic form, supplemented by the linearized Rankine–Hugoniot jump conditions across the leading shock. The simplified formulation is used to analyze the interaction of the oblique detonation with a weak vortex sheet, for an Arrhenius irreversible reaction with an activation energy large compared with the postshock thermal enthalpy. The analysis reveals that, as , the product of the activation energy and the heat release divided by the square of the postshock thermal enthalpy, increases through values of order unity, decaying spatial oscillations, found for small values, are replaced by persistent nonlinear oscillations of finite amplitude for larger values. Beyond a critical value of the growth of the oscillation amplitude leads to the development of a singularity at the shock, an explosion, consistent with the formation of a triple point. Many related problems can be clarified with this formulation.",58,1
21,https://doi.org/10.2514/1.J058707,"A plate sinking in supersonic flow rapidly with pure acceleration was shown recently to have a flow structure and force behavior similar to those caused by a large-amplitude step motion, and this force evolution can be predicted by a nonlinear weighted Duhamel integral integrating a nonlinear solution due to large-amplitude forward step motions. In this paper, this previous study is extended to a more complex case, in which the plate sinks in supersonic flow with acceleration in the first stage and deceleration in the second stage, and stops sinking in the last stage. The flow structures are clarified numerically for each stage, according to whether the sinking is slow or fast compared to the horizontal wave speed, and the force-evolution behavior is displayed and related to the flow structures. It was found that a residual force exists during the motionless stage for fast sinking, due to the historical effect of wave evolution. In addition, although the nonlinear weighted Duhamel method predicts the force well for the first and second stages, it performs less well than a linear force method for the third stage, showing that a force method based on the forward step-motion model should be revised in the future.",58,1
22,https://doi.org/10.2514/1.J058564,"The concept of the generalized hypersonic equivalence principle for viscous flows is proposed in this paper. The traditional hypersonic equivalence principle applies only to the inviscid flows and pressure prediction. The present generalized principle indicates that the skin friction and the heat flux resulting from a steady viscous flow over a slender body could also be approximately analogous to the counterparts in an equivalent unsteady flow in one less space dimension. The key point is that the hypersonic velocity component perpendicular to the reduced unsteady flow plane should be retained and its evolution with time be properly treated to produce strong shear and dissipation effects. The generalized principle is specifically implemented by using the direct simulation Monte Carlo method to study the fundamental boundary-layer flow models and a practical complex viscous-interaction flow over a typical vehicle model. The results of the pressure, skin friction, and heat flux from the steady flows and the corresponding reduced unsteady flows are compared and analyzed. This study points out an inherent similarity between the hypersonic steady flow and the dimension-reduced unsteady flow, and also shows a potential application value in the engineering practice.",58,1
23,https://doi.org/10.2514/1.J058472,"A contemporary issue of crucial importance for further developments in the field of thermal protection systems and related arcjet-based testing activities calls for improvements in existing abilities to measure the centerline total enthalpy. Starting from the original assumptions of Vincenti and Kruger (Introduction to Physical Gas Dynamics, Wiley, New York, 1965) and through the elaboration of a mathematical framework relying on a specific modeling hierarchy of balance equations for the moles of different species involved, it is shown that the extension of the frozen sonic flow method (FSFM) to the case of polyatomic molecules can be made well posed. Dedicated experiments have been conducted using a reentry simulation facility and varying the mass-averaged enthalpy in the range between 5 and . In particular, three different gas mixtures have been considered (using nitrogen as a hot feeding gas and adding cold oxygen, carbon dioxide, and methane, respectively). The enthalpy ratios calculated by the FSFM, which were found to depend on the gas mixture, have been compared with the values determined using two alternate techniques, namely, 1) the heating rate method and 2) the calorimetric probe method. Given the extremely complex experimental conditions considered (high-enthalpy, low density, and supersonic reactive flows), the agreement between the theoretical and experimental results can be considered very satisfactory.",58,1
24,https://doi.org/10.2514/1.J058543,"The interplay of a gas–surface interaction and thermal nonequilibrium is still an open problem in aerothermodynamics. In the case of reusable thermal protection systems, it is unclear how much of the recombination energy is stored internally in the molecules produced by surface catalytic reactions, potentially leading to nonequilibrium between their translational and internal energy modes. A methodology is developed to calculate the energy accommodation coefficient using a rovibrational state-to-state chemical mechanism for a nitrogen mixture coupled with a generalized form of the catalytic recombination coefficient. The flow around a spherical body is simulated in hypersonic conditions, allowing study of the amount of energy deposited on the surface and stored in the recombining molecules. Internal energy quenching into translational energy is found, which is a phenomenon also observed experimentally, keeping the total energy transferred to the surface overall constant. The methodology developed for the application of a state-to-state model in the computational fluid dynamics framework coupled with catalysis is generic and applicable to a variety of other similar mechanisms.",58,1
25,https://doi.org/10.2514/1.J058607,"In this study, a simple model was developed to describe the mechanism behind a nonintrusive method that uses air glow discharge to simultaneously measure the gas density and temperature in low-density, short-duration hypersonic facilities. The developed model revealed that the emission intensity of the second positive band system of nitrogen molecules varies linearly with the gas density, which was firmly supported by spectroscopic observations characterizing the glow spectra. A laminar separated boundary layer was visually distinguishable via variations in the emission color reflected on a uniform positive column, along which traverse measurements were performed using miniature spectrometers. The experimental spectra agreed fairly well with synthetic ones calculated by substituting gas temperature distribution determined from computational fluid dynamics. In contrast, the temperature was not found to be a crucial factor determining the emission color distribution. The color was instead found to vary with the ratio of the emission intensity of the first positive band system to that of the second one. The principle of the variation in emission color implies that the mechanism explaining the variation will be more complex than what is assumed in existing models.",58,1
26,https://doi.org/10.2514/1.J058405,"The double swept waverider is a classic example of the planform-customized osculating-cone waveriders, delivering satisfactory performances over a wide range of velocities. The nonlinear increase in the lift of double swept waveriders at high angles of attack is of vital interest. In this paper, the aerodynamic performance of the double swept waverider is calculated and compared with single swept waveriders. The results suggest that the nonlinear increase in the lift of the double swept waverider is stronger than that of the equal-planform-area single swept waverider, and it increases with the Mach number. Some scholars have proposed the “vortex lift” to explain the nonlinear increase in lift, but it is controversial because the main lift of the waverider comes from the lower rather than the upper surface. This paper proposes that this nonlinear increase is related to the attachment of the shock wave influenced by the leading-edge sweep angle. The shock wave is more inclined to attach under the lower surface at a smaller sweep angle than a larger one as the angle of attack increases. When the shock wave attaches, the increase in pressure via the angle of attack is nonlinear, leading to a nonlinear increase in lift. When the shock wave detaches, the increase in lift is approximately linear.",58,1
27,https://doi.org/10.2514/1.J058689,"In this paper, a novel gas-kinetic harmonic balance method (HBM) is developed for unsteady flows with oscillating motions. Particularly, the emphasis here is on supersonic and hypersonic flows. Because of the presence of an additional source term in the harmonic balance equations, usually very small time steps are needed for explicit algorithms, and some factorization-based implicit algorithms may fail to converge in the case of higher frequencies. To achieve better convergence performance and robustness, a Jacobian-free Newton–Krylov method is adopted. By constructing a simplified preconditioning matrix, the lower–upper symmetric Gauss–Seidel scheme is employed as a preconditioner, so that the computational cost and memory requirement can be reduced. Considering that conventional spatial discretization schemes may encounter numerical difficulties and low robustness in high-Mach-number flows, a more general gas-kinetic scheme (GKS) is extended for the harmonic balance equations. As the HBM solves a mathematically steady problem, the present GKS focuses on evaluation of the time-independent fluxes at each cell interface and each subtime level. The gas-kinetic HBM is applied to a supersonic oscillating flat plate cascade and an oscillating panel in hypersonic flow. By comparison with other methods, the advantages of the developed method are demonstrated.",58,1
28,https://doi.org/10.2514/1.J058470,"A new surrogate modeling approach is developed that augments the loads from an analysis over an undeformed surface in order to account for the effects of static surface deformations in high-speed flows. The approach relies on pointwise data-driven surrogates to approximate the nonlinear flow mechanics and theoretical expressions to identify the surrogate input parameters. The pointwise nature of the model enables efficient construction with minimal assumptions on the surface deformation. The accuracy of the modeling strategy is evaluated relative to steady Reynolds-averaged Navier–Stokes analyses for prescribed deformations and quasi-static aerothermoelastic response prediction. Basic fluid loads models and conventional kriging interpolation models, where deformation is parameterized using global characteristic shapes, are also considered. The new surrogate approach yields normalized root mean square errors of less than 5% relative to steady Reynolds-averaged Navier–Stokes predictions of pressure and heat flux over prescribed deformations. Results for aerothermoelastic simulations highlight that the approach outperforms all other models in terms of predicting the thermo-structural response and fluid loads. In regard to computational requirements, the new approach affords a 93% reduction in the offline costs compared with conventional kriging models and is several orders of magnitude faster than Reynolds-averaged Navier–Stokes simulations for online predictions.",58,1
29,https://doi.org/10.2514/1.J058514,"A study is conducted to evaluate four derivative estimation methods when solving a large sparse nonlinear programming problem that arises from the approximation of an optimal control problem using a direct collocation method. In particular, the Taylor series-based finite difference, bicomplex-step, and hyper-dual derivative estimation methods are evaluated and compared alongside a well-known automatic differentiation method. The performance of each derivative estimation method is assessed based on the number of iterations, the computation time per iteration, and the total computation time required to solve the nonlinear programming problem. The efficiency of each of the four derivative estimation methods is compared by solving three benchmark optimal control problems. It is found that, although central finite differencing is typically more efficient per iteration than either the hyper-dual or the bicomplex-step method, the latter two methods have significantly lower overall computation times due to the fact that fewer iterations are required by the nonlinear programming problem when compared with central finite differencing. Furthermore, although the bicomplex-step and hyper-dual methods are similar in performance, the hyper-dual method is significantly easier to implement. Moreover, the automatic differentiation method is found to be substantially less computationally efficient than any of the three Taylor series-based methods. The results of this study show that the hyper-dual method offers several benefits over the other three methods: both in terms of computational efficiency and ease of implementation.",58,1
30,https://doi.org/10.2514/1.J058629,"The nonlocal three-dimensional vibration analysis of rectangular plates is investigated within the framework of fractional calculus in the sense of the Caputo fractional derivative. To show the effect of the fractional derivative on nonlocality, the frequency spectra of the plates with different boundary conditions and symmetry modes are carried out for the different orders of the fractional derivative and different values of the length scale parameter . The vibration analysis is obtained by the Ritz energy method, whereas Chebyshev polynomials are used as admissible functions. The results of the frequency spectrum demonstrate that the nonlocal effect decreases and the results get closer to the values of the classical frequencies as the order of the fractional derivative approaches the classical derivative .",58,1
31,https://doi.org/10.2514/1.J058593,"This paper presents the development of an aeroelastic analysis formulation for the dynamic response of a flexible wing. The geometrically nonlinear structure is represented by a reduced-order model that accounts for the large-deformation effects on the inertia and stiffness terms. It is based on a system identification of a built-up finite element model and does not rely on a geometric nonlinear beam-based model as most of the state-of-the-art nonlinear aeroelastic frameworks do. The complexity of the wing structural layout is captured in the built-up finite element model as in traditional industry applications. To preserve a small number of states to represent the structural dynamics of the system, a modal approach is used in a nonlinear sense. Moreover, this approach is easily linked to computational fluid dynamics. For this study, the structural reduced-order model framework is integrated within the aeroelastic framework of the code CFL3D. Using this integrated solution, the aeroelastic response of a high-aspect-ratio wing is investigated.",58,1
32,https://doi.org/10.2514/1.J058418,"This paper answers the question raised in the title of this paper and shows that it is not true for systems in which the damping matrix is indefinite. It introduces a new paradigm in the theory of linear stability that gyroscopically stabilized unstable potential systems can be made stable, and even exponentially stable, by the addition of linear damping. Conceptually, the paper also points to a practical methodology for adding damping to such gyroscopically stabilized potential systems to render them exponentially stable. The methodology involves the simultaneous use of both dissipative damping or negative velocity feedback, and positive velocity feedback. The methodology is illustrated in detail on two-degree-of-freedom gyroscopically stabilized potential systems. In-depth stability analysis of such systems is provided. It is shown that they can always be made exponentially stable by using an uncountably infinite number of appropriate indefinite damping matrices. A connected region is proved to exist in the space of indefinite damping matrices for which such damped gyroscopically stabilized systems are guaranteed to be exponentially stable, and this region of exponential stability is analytically delineated. Numerical studies are provided to corroborate the analytical results.",58,1
33,https://doi.org/10.2514/1.J058118,"A general formulation is presented to linear multipoint constraints, underlying that the linkages of mechanical system dynamics are governed by kinematic constraint conditions. Both rigid and interpolated multipoint constraints are then described in a formulation based on the Lagrange multiplier adjunction. The proposed formulation can directly offer reaction forces, which are essential information to modeling linkages of mechanical components. In particular, in the interpolated multipoint constraints, the proposed formulation is more numerically stable than the conventional master–slave formulation that has invertible issues with respect to choice of the constraint nodes. The other aim of the work is to condense the original equations of motion into degrees of freedom at certain nodes only, named as condensation nodes, for better computational and modeling efficiencies. In the proposed Lagrange multiplier based formulation, accuracy of the reduced model can be improved by dynamic correction. The performance of the proposed method is theoretically evaluated by comparing the master–slave elimination, which is the most widely used approach of the multipoint constraints, and it is demonstrated through numerical examples.",58,1
34,https://doi.org/10.2514/1.J058561,"A new mixed-boundary model reduction technique is presented for nonlinear forced response analysis of mistuned bladed disks with shroud friction contacts. In contrast to conventional fixed- or free-mode component mode synthesis (CMS) techniques, blades are reduced in a mixed-boundary fashion. Accordingly, blade component normal modes with a more realistic mixed boundary condition (fixed at blade-disk interface and free at shroud contacts) are incorporated into the reduction basis. Afterward a modal synthesis based on loaded interface modeshapes of the disk is performed to reduce the disk component and the previously retained blade-disk interface degrees of freedom (DOFs). This results in a compact reduced order model (ROM) in which retained physical DOFs contain only shroud contact nodes. During the reduction steps, sector-level frequency mistuning is efficiently introduced into the ROM. In addition, the reduction basis is invariant of the mistuning pattern, which makes the ROM suitable for statistical characterization of nonlinear response levels. The final ROM is computed using one single sector only and with minimal computational effort. Numerical simulations revealed an improved accuracy of the ROM based on the mixed-boundary model in predicting the nonlinear forced response levels of a mistuned bladed disk with shroud friction contacts.",58,1
35,https://doi.org/10.2514/1.J058645,"In this paper, an enhanced response sensitivity approach is proposed for parameter identification of nonlinear time-delay aeroelastic systems. Two common aeroelastic models are investigated, namely, the aeroelastic system under the unsteady Theodorsen aerodynamic forces and the airfoil-store system under the steady incompressible flow. The work of this paper is mainly threefold. First, the motion equations of two aeroelastic models including time-delay signals are derived, and the response sensitivity analysis with respect to the system parameters is conducted. Then, parameter identification is formulated as a nonlinear least-squares problem, and the enhanced response sensitivity approach is developed to get the solution. Finally, numerical examples are studied to verify the effectiveness of the proposed method. The results reveal that the proposed approach can give accurate, robust, and efficient identification of the parameters for time-delay aeroelastic systems.",58,1
36,https://doi.org/10.2514/1.J058529,"This study aims to develop a linear nonintrusive reduced-order model (NIROM) for facilitating combined fast parametric analysis and reconstruction of unsteady aerodynamic flow variables by using a novel signal interpolation approach, which is combined with a subspace-identification-based method. The NIROM is then applied to airfoil flutter and gust interaction problems where the assumption of linearized dynamics gives reasonably accurate estimates. In the traditional subspace-identification method, the training datasets of force coefficient signals corresponding to each flow parameter (like the Mach number and angle of attack) are required to generate the linear time-invariant system. The generation of the training signal for each flow parameter is the most computationally expensive process in any parametric reduced-order model (ROM). In the present work, the discrete empirical interpolation method (DEIM) combined with the radial basis function (RBF) method is used for the interpolation of training signals at a specific flow parameter to reduce the overall computational cost. The conventional nonintrusive approaches are generally constrained by the number of output channels, and hence not suitable for the reconstruction of unsteady surface force distribution or flowfield variables. A few suitable sensor locations using the DEIM are selected as output channels of the subspace-identification method to realize the full datasets of surface force distribution over the airfoil. Finally, a suitable algorithmic structure is proposed to achieve unsteady distributive flow-variable reconstruction and parametric variation simultaneously. The current signal interpolation-based NIROM is applied to a wing section with two- and four-degree-of-freedom structural motions.",58,1
37,https://doi.org/10.2514/1.J058600,"Flow-induced flutter of elastic membranes has many applications in engineering, biology, and medicine; and recent advances in computational modeling are enabling the simulation of such problems in unprecedented detail. However, appropriate experiments that would allow comprehensive validation of such models are lacking. To fill this gap, low-Reynolds-number experiments were conducted on the flow-induced flutter of a suspended elastic membrane. This configuration has well-defined boundary conditions and exhibits a variety of flutter regimes, thereby making it a suitable case for validation. Silicon sheets of three different thicknesses are used as the material for the suspended membrane, and the other key variables in the study are the flow speed and the yaw angle of the membrane. The deflection and flutter motion of each membrane is measured using a high-speed imaging system. A variety of flutter regimes are observed for the parameters studied here, including nominally two-dimensional flutter as well as highly three-dimensional motion for nonzero yaw angles. Qualitative as well as quantitative features of the flutter are cataloged in order to provide a comprehensive dataset for validation.",58,1
38,https://doi.org/10.2514/1.J058465,"An approach based on the cohesive zone model for analyzing delamination in composite laminates under cyclic fatigue loading is presented. The proposed technique, called “min-max load approach,” is able to dynamically capture the local stress ratio during the progression of delamination. The possibility to know the local stress ratio is relevant in all the situations where its value is different from the applied load ratio and cannot be determined a priori. The methodology analyzes in a single finite element analysis two identical models with two different constant loads, the minimum and the maximum load of the fatigue cycle. The two models interact with each other, exchanging information to calculate the crack growth rate. At first, the approach has been validated in simulations of mode I and mixed-mode propagation using double cantilever beam and mixed-mode bending tests. Then, to prove the effectiveness of the developed methodology, a modified version of the mixed-mode bending test has been analyzed. Mode I and mode II components of the load are decoupled and applied independently, resulting in a local stress ratio different from the applied load ratio. The results obtained from the simulations, compared with the analytical model obtained using the corrected beam theory, show that the proposed approach is able to predict the local stress ratio and thereby to correctly evaluate the crack growth rate during the propagation of the damage.",58,1
