,doi,abstract,volume,issue
0,https://doi.org/10.2514/1.J059285,,58,1
1,https://doi.org/10.2514/1.J058731,"A novel high-frequency flow control strategy for mitigation of dynamic stall is demonstrated for the case of a finite wing using high-fidelity wall-resolved implicit large-eddy simulations. A NACA 0012 wing of aspect ratio is considered at freestream Mach number and chord Reynolds number . The wing undergoes an oscillatory pitching motion with reduced frequency and maximum angle of attack , resulting in deep dynamic stall for the baseline case. Very-high-frequency spanwise uniform low-amplitude pulsed forcing is imparted through a zero-net mass flow blowing/suction slot located on the wing lower surface near the leading edge. The imposed small fluctuations are amplified by the laminar separation bubble (LSB) and inhibit LSB bursting and the formation of large-scale dynamic stall vortices. By maintaining effectively attached flow throughout the pitching cycle, actuation provides a significant reduction in the cycle-averaged drag and in the force and moment excursions. In addition, the negative (unstable) net-cycle pitch damping found in the baseline case is eliminated.",58,1
2,https://doi.org/10.2514/1.J058687,"The use of surrogate models (response surface models, curve fits) of various types (radial basis functions, Gaussian process models, neural networks, support vector machines, etc.) is now an accepted way for speeding up design search and optimization in many fields of engineering that require the use of expensive computer simulations, including problems with multiple goals and multiple domains. Surrogates are also widely used in dealing with uncertainty quantification of expensive black-box codes where there are strict limits on the number of function evaluations that can be afforded in estimating the statistical properties of derived performance quantities. This paper compares and contrasts a wide range of surrogate types on an aerodynamic section data set that allows for design variation, manufacturing uncertainty, and damage in service, all solved with a high-quality industrial-strength Reynolds-averaged Navier–Stokes solver. This paper examines speed of training and model quality for different sizes of problem up to one where there are 26 input variables and nearly half a million CFD results in the available data set.",58,1
3,https://doi.org/10.2514/1.J058291,"This study investigates the accuracy of deep learning models for the inference of Reynolds-averaged Navier–Stokes (RANS) solutions. This study focuses on a modernized U-net architecture and evaluates a large number of trained neural networks with respect to their accuracy for the calculation of pressure and velocity distributions. In particular, it is illustrated how training data size and the number of weights influence the accuracy of the solutions. With the best models, this study arrives at a mean relative pressure and velocity error of less than 3% across a range of previously unseen airfoil shapes. In addition all source code is publicly available in order to ensure reproducibility and to provide a starting point for researchers interested in deep learning methods for physics problems. Although this work focuses on RANS solutions, the neural network architecture and learning setup are very generic, and applicable to a wide range of partial differential equation boundary value problems on Cartesian grids.",58,1
4,https://doi.org/10.2514/1.J058437,"General expressions are derived in this paper for the aerodynamic force and moment on an arbitrary set of pitching and heaving foils from the vortical impulse theory in the limit of linearized potential, two-dimensional flow. Of special interest for studying the propulsion of some aquatic and aerial animals and small unmanned vehicles is the case of two oscillating foils in an aligned tandem configuration, for which analytical explicit expressions for the lift, thrust, and moment are obtained. In the limit of large separation distance, the expressions of a single oscillating foil for the forewing are recovered, but the hindwing is always affected by the unsteady wake of the forewing in the present inviscid model. Relatively simple expressions are obtained in the cases of two heaving foils and of two pitching foils, for which the optimal conditions generating a maximum thrust force and a maximum propulsion efficiency are mapped in terms of the nondimensional separation distance, reduced frequency, and phase shift, and discussed physically in relation to the optimal results for a single oscillating foil. The present theoretical results are compared with available experimental and numerical data, with good agreement for small amplitude of the oscillations and sufficiently high Reynolds numbers.",58,1
5,https://doi.org/10.2514/1.J058598,"The unsteady flows past a NACA0015 airfoil near stall at a high Reynolds number are investigated numerically using the delayed detached-eddy simulation with adaptive coefficient model. The unsteady feature is primarily represented by a low-frequency oscillation, attributed to the quasi-period movement of the separation point. Correlation analysis between the instantaneous lift coefficient and separation point location indicates that the two signals present nearly in-phase behavior. Other unsteady characteristics such as the trailing-edge vortex shedding and instability of the upper surface shear layer are also analyzed. Since the Strouhal number corresponding to the movement of the separation point based on the projected airfoil height varies significantly with the angle of attack, the normalized Strouhal number based on the length of the recirculation region is observed to have a value of approximately 0.036 and be insensitive to the angle of attack.",58,1
6,https://doi.org/10.2514/1.J058649,"The behaviors of a pulsed microsecond dielectric barrier discharge in quiescent air are diagnosed by schlieren image and particle image velocimetry. Some localized pressure waves are induced by the discharge, propagating at a speed of about . A fairly weak vortex is also induced, with a maximum velocity of about . Wind tunnel experiments are conducted on a wing–body combination with a 47 deg swept wing. Three actuator arrangements are tested by force measurements. For the full leading-edge actuation, obvious changes of the normal forces can be achieved at high angles of attack before stall, when the actuator works at the optimum reduced frequency of . However, the stall angle is not delayed under the actuation. For front-half actuation at the leading edge, the obvious control effect is obtained at large angles of attack (22–30 deg), while for rear-half actuation, the normal force gets a relatively modest increase at a broad range of attack angles (10–34 deg). The flow pattern obtained by particle image velocimetry shows that the actuation frequency mainly determines the number of chordwise vortices coexisting along the shear layer. It is hard to engender the reattachment vortex over the wing under high-frequency actuations (such as ).",58,1
7,https://doi.org/10.2514/1.J058555,"This paper studies the similarities between the three-dimensional (3-D) cellular patterns that appear in conditions of transonic buffet and subsonic stall, using Reynolds-averaged Navier–Stokes/unsteady Reynolds-averaged Navier–Stokes simulations. The geometries are obtained from the extrusion of a two-dimensional (2-D) airfoil with an added sweep angle, and periodic boundary conditions are imposed at both ends. First, numerical simulations of transonic buffet are performed. The numerical solutions exhibit three-dimensional cellular flow patterns, forming what has been named buffet cells. The latter are convected in the spanwise direction when a sweep angle is added, leading to the superposition of two frequencies. The first one is independent of the sweep angle and is characteristic of the two-dimensional buffet. The second one increases with the sweep angle and is related to the convection of the buffet cells. These cells are reminiscent of the stall cells, which are well known for low-speed flow conditions. Second, solutions of the unsteady Reynolds-averaged Navier–Stokes equations for infinite swept wings in stall conditions at low speed are computed, showing the same convection of the cellular patterns. These results indicate that the discrepancies between 2-D and 3-D buffet are caused by the appearance of stall cells, which are the same as buffet cells.",58,1
8,https://doi.org/10.2514/1.J058488,"The proposed passive control method, blade-end slots, is implemented to reorganize the blade-end flow in a highly loaded compressor cascade under a wide incidence range at . Both experimental and numerical investigations are conducted to validate the control effect and reveal the control mechanism. Experimental results show that the proposed method can effectively suppress the corner separation and broaden the effective operating range. The total pressure loss in the measurement plane is significantly reduced, ranging as high as 18.4, 20.6, 24.3, and 39.4% under the incidence angle of , 0°, 2° and 4°, respectively. Flow details indicate that the blade-end slots can generate self-adaptive high-momentum jet flows through the pressure difference between blade pressure and suction surface. The self-adaptive jet flow reenergizes the local low-momentum fluid to reduce separation, and restrain its migration toward midspan. The low-momentum flows near the endwall on the pressure side are aspirated, thus weakening the cross-passage migration of low-momentum endwall flow into suction surface corner. Proportion of unseparated regions in the blade midspan is enlarged; consequently, flow capacities are improved. The attachment at the blade-end regions is enhanced, and the insufficient circulation originally found at the blade extremity is improved.",58,1
9,https://doi.org/10.2514/1.J058513,"Dynamically extendable blade chord sections show promise for reducing helicopter rotor loads. A rotor model based on an elastic beam concept, and capable of predicting helicopter power, is used. A stiff in-plane four-bladed rotor with a shape similar to the UH-60A rotor is used as a baseline for comparisons. For the control of the 4/rev (per revolution) vertical hub force, it is not beneficial to actuate the extendable chord at hover and low-speed flight. At a high speed of , the extendable chord, with a width of 10% rotor radius and responded to an extension magnitude of 10% chord length, obtained a maximum force reduction of 89.4%. The magnitude of the dynamic chord needs to be optimized according to the flight state. The performance can be enhanced by increasing the extension or width of the dynamic chord. The dynamically extendable chord was not suitable for reducing the 2/rev blade flapwise root bending moment. However, a 3/rev dynamic chord extension showed great potential in reducing the 3/rev flapwise root bending moment and the 4/rev rotor rolling and pitching moments simultaneously. The effectiveness of a 5/rev dynamic chord in reducing the 4/rev rotor rolling or pitching moment degraded significantly as compared with a 3/rev actuation.",58,1
10,https://doi.org/10.2514/1.J058519,"This study experimentally investigated the effects of repetitive laser energy deposition using a supersonic intake model with a central conical compression surface and a cross-sectional duct in a Mach 1.92 indraft wind tunnel: especially in the subcritical and buzz modes. A single-pulse energy deposition was observed to suppress the flow separation at the compression surface by “sweeping” a shock wave system with the thermal bubble generated by the energy deposition. The duration of the sweeping effect was approximately in the subcritical mode and in the buzz mode. Furthermore, repetitive deposition of laser pulse energies was observed to moderate instabilities in both modes, and it increased the pressure recovery by as much as 8%; also, the occurrence of buzz was delayed, thereby widening the stable, subcritical regime. In both modes, there was a threshold value for the laser pulse repetition frequency , which corresponded to the duration of the sweeping effect (e.g., in subcritical mode). Below this frequency, the increase in the pressure was proportional to the repetition frequency; whereas above , the effect per single pulse was reduced.",58,1
11,https://doi.org/10.2514/1.J058266,"This paper investigates the method for predicting the laminar-to-turbulent transition in the context of hybrid laminar flow control. Transonic wind tunnel experiments are used to support our study. The relation between the discrete hole velocity in wind tunnel tests and the continuous surface velocity used in the simulation is established. With the calibrated relation, the method, consisting of a boundary-layer code and linear stability theory framework, has successfully predicted the transition location at various conditions, within 4% chord error compared with the experimental results. Additionally, the simulation profile drag by the integration of momentum loss method matches the results of the experimental wake rake, and the difference is within 1.85 counts. The simulation results show that the microsized wall suctioning reduces the amplitude of cross-flow velocity and lowers the inflection point in the boundary layer, hence suppressing the cross-flow vortices. Hence, the laminar-to-turbulent transition is pushed aft significantly. Meanwhile, the experimental and simulation results show that the wall blowing degrades the HLFC benefit, and it needs to be avoided in applications. This paper concludes that the method can be applied in the hybrid laminar flow control transition prediction with the given perforated panel properties.",58,1
12,https://doi.org/10.2514/1.J058556,"Turbulent planar mixing layers of varying compressibility levels have been studied experimentally via flow visualization techniques, pressure measurements, and stereoscopic particle image velocimetry. The experiments were conducted for five different convective Mach numbers (, 0.38, 0.55, 0.69, and 0.88). For each case, inflow conditions were thoroughly documented with planar particle image velocimetry. Results indicate that the incoming boundary layers are thin (less than or equal to 9% of channel height) and fully developed. Schlieren and Mie scattering images show that for increased levels of compressibility the large-scale turbulent structures are less organized, and the Brown–Roshko rollers that are dominant in the incompressible case are not found. Three-component velocity measurements made on the spanwise-central plane via stereo particle image velocimetry confirm the reduction in the normalized growth rate with increasing that has been agreed upon widely. Turbulence statistics results show that the peak (normalized) streamwise normal kinematic Reynolds stress remains constant, while the spanwise normal, transverse normal, and primary shear kinematic Reynolds stress peak values all decrease with increasing . In addition, knowledge of all three normal stress components allows for the calculation of the full Reynolds stress anisotropy tensor, a novel result for compressible mixing layer experiments. Each anisotropy component remains constant across the shear layer center. As compressibility in the mixing layer increases, the streamwise normal stress anisotropy increases, transverse and spanwise normal stress anisotropies decrease, and the shear stress anisotropy remains constant. Conversely, the Reynolds stress correlation coefficient remains constant across all cases at approximately 0.47.",58,1
13,https://doi.org/10.2514/1.J058302,"Strongly swirling flow is widely encountered in engineering applications. However, accurate prediction of the flow is still challenging for turbulence modeling. The present study reports the assessment and validation of a newly developed self-adaptive turbulence modeling, denoted as very-large-eddy simulation (VLES), for the prediction of turbulent strongly swirling flow through a suddenly expanding circular pipe at Reynolds number of and , and the corresponding swirl numbers are 1.16 and 1.23, which are both very strongly swirling flow. The VLES method is a unified simulation approach enabling a seamless evolution from Reynolds-Averaged Navier–Stokes (RANS) to LES and finally approaching direct numerical simulation (DNS) depending on the numerical resolution. In the present work, a new proposed VLES turbulence closure model, namely, VLES BSL , and other two models, denoted as VLES and VLES , are applied for the strong swirling flow simulation. Two meshes containing about 0.9 million and 5.1 million cells are applied, with different mesh resolutions. The simulation results are compared with available experimental data and RANS results. It is observed that the present VLES models accurately predict the time-averaged and root-mean-square (rms) velocities compared with the measurements on both of the two meshes. The significant features of the present strongly swirling flow, including vortex breakdown and the vortex core precession, large recirculation region, and shear-layer instability, are well captured by the present VLES models. Furthermore, the anisotropy of the Reynolds stresses of the strongly swirling flow is also well predicted. Satisfactory predictions can be obtained using low grid resolution with the VLES models, which confirm the validity and accuracy of the VLES modeling for strongly swirling turbulent flow.",58,1
14,https://doi.org/10.2514/1.J058203,"The wave-number-frequency spectra of a pressure field beneath a turbulent boundary layer is considered, with the aim of removing the effect of the measuring device. A rotating antenna of aligned microphones has been used in previous studies, and the measured spectra are shown to be a convolution of the true spectra with the transfer function of said antenna. Deconvolution algorithms that were previously developed for other fields of studies are presented. Test cases and processing of experimental data are used to assess their applicability. A hybrid approach of both deconvolution and interpolation, to artificially refine the azimuthal discretization, is found to be best at estimating both narrowband and broadband components of the spectra.",58,1
15,https://doi.org/10.2514/1.J058742,"Partially averaged Navier–Stokes (PANS) is a scale-resolving simulation (SRS) approach wherein a two-equation closure model is suitably adapted for computing unresolved stresses. The objective of the present study is to develop a two-layer PANS closure for improved near-wall simulation capability. In the RANS context, the two-layer turbulence model displays superior near-wall behavior compared with other closures of similar order. Our goal is to adapt these near-wall closure advantages to PANS-SRS model. In the outer region of the PANS two-layer closure, a PANS turbulence model is employed. In the inner layer, an unresolved kinetic energy equation is solved. The eddy viscosity and dissipation are specified using algebraic equations based on known scaling relationships. The proposed model is evaluated in a turbulent channel flow of friction Reynolds numbers in the range of . Comparison with DNS data demonstrates that two-layer PANS is potentially an accurate and robust SRS approach.",58,1
16,https://doi.org/10.2514/1.J058434,"High-order numerical methods for unstructured grids combine the superior accuracy of high-order spectral or finite difference methods with the geometric flexibility of low-order finite volume or finite element schemes. Over the past few years, they have shown promise in enabling implicit large-eddy simulations within the vicinity of complex geometrical configurations. However, the cost of such simulations remains prohibitive. In this paper, the impact of number representation on the efficiency and efficacy of these methods is considered. Theoretical performance models are derived and assessed. Specifically, four test cases are considered: 1) the viscous Taylor–Green vortex, 2) flow over a circular cylinder, 3) flow through a T106c low-pressure turbine cascade, and 4) flow around a NACA 0021 in deep stall. It is found that the use of single (in lieu of double) precision arithmetic does not have a significant impact on accuracy. The performance of the resulting simulations was found to improve between 1.4 and 2.9 times.",58,1
17,https://doi.org/10.2514/1.J058357,"This paper provides a novel approach for mesh generation for materials that have distinct spatial components with a smooth boundary between them. Experimental data are used in pixel/voxel format to label elements in a generic finite element (FE) mesh of a representative volume element. The basis of this approach is a novel Potts energy formulation to allow integer optimization on the dual of the FE mesh. The Potts energy can be decomposed into two terms: the field energy/data cost and the interaction energy/smoothing cost. The field term is used to represent the likelihood of a grain label on an element based on the experimental voxel data. The interaction term encodes a prior on this labeling; in particular, it is used for smoothening the phase boundary. Energy minimization of this system leads to a multiway cut problem, which is solved using graph cuts. A multilabel energy minimization problem is formulated using a Potts form. This methodology allows capturing smooth boundaries in materials with nonequiaxed morphologies. Applications to polycrystalline microstructures and woven composites are presented. The extension to nonequiaxed morphologies is presented using the Riemannian distance measure. This procedure allows re-usability of an FE mesh by adaptively assigning pixel/voxel information to elements while preserving important features like the phase boundary surface length/area.",58,1
18,https://doi.org/10.2514/1.J058017,"Airborne noise with a dominant low-frequency content has detrimental effects in many applications, but it is as yet beyond the scope of conventional acoustic noise mitigation techniques using liners, foams, or claddings owing to mass and volume considerations. An alternative approach using liner configurations retaining realistic mass and volume constraints and having innovative 3D folded core geometries is investigated to ascertain its low-frequency noise absorption performance. The relative performance of various candidate 3D folded core designs is compared using a metric termed the low-frequency performance (LFP) metric, which is derived from Zwikker-Kosten Transmission Line (ZKTL) theory–based numerical studies. An LFP-based software tool is developed to optimize packing of 3D folded cavities. Experimental verification of absorption coefficient spectra conducted using additively manufactured test articles in normal incidence acoustic impedance tubes yielded good correlation with simulations, verifying the feasibility of this approach. For an optimized design, more than 100 Hz of continuous bandwidth with an absorption coefficient greater than 0.6 is shown to be possible in the 250–400 Hz range with a liner 38.1 mm (1.5 in.) thick. With current additive and hybrid manufacturing techniques attaining critical commercial maturity, 3D folded cavity liners could provide a promising practical solution to mitigate low-frequency airborne noise, especially in aerospace applications.",58,1
19,https://doi.org/10.2514/1.J058036,A computational study is presented of the nonlinear combustion instability of a multi-injector rocket engine. The study addresses a choked nozzle and a combustion chamber with 10 and 19 coaxial injector ports. Computations using a three-dimensional unsteady shear-stress transport delayed detached-eddy simulation method provide detailed time-resolved information about the combustion instability. The spontaneous longitudinal-mode instability is observed for the 10- and 19-injector geometries with a combustion-chamber diameter of 28 cm. The triggered tangential and longitudinal instability modes are obtained for the 19-injector geometry with a combustion-chamber diameter of 43 cm by pulsing the injector mass flux. It is shown that an oscillating combustion-chamber flow can be triggered to a new mode with a larger disturbance amplitude. The streamwise vorticity created by the instability impacts the heat release in a manner that supports the instability. A preliminary study of injector-size scaling effects is performed by comparison of the 10- and 19-injector combustors.,58,1
