,doi,abstract,volume,issue
23,https://doi.org/10.2514/1.C032043,"This article proposes simultaneous helicopter and control system design and illustrates its advantages. First, the traditional, sequential approach in which a satisfactory control system is designed for a given helicopter is applied. Then, a novel approach, in which the helicopter and control system are simultaneously designed, is applied to redesign the entire system. This redesign process involves selecting certain helicopter parameters as well as control system parameters. For both design procedures the key objectives are to minimize control energy and satisfy prescribed variance constraints on specific outputs. In order to solve the complex optimization problem corresponding to the simultaneous design approach, an efficient solution algorithm is developed by modifying the simultaneous perturbation stochastic approximation method to account for limits on optimization parameters. The algorithm is applied to redesign helicopters using models generated in straight level as well as maneuvering flight conditions. The performance of the designs obtained using the sequential and simultaneous design approaches is compared and the redesign process is thoroughly investigated. Finally, the robustness of the redesigned systems is also studied.",50,3
24,https://doi.org/10.2514/1.C032057,"Data from flights by the South Dakota School of Mines and Technology’s North American T-28 storm-penetrating aircraft during nine different research projects conducted between 1991 and 2003 are analyzed. These flights, usually flown during the summer months in the central and high plains in the United States, targeted regions of convective storms containing vigorous updrafts, downdrafts, and precipitation, including hail. Observations indicate that three of the most hazardous components of flying in summertime deep convective clouds are aircraft icing, turbulence from strong vertical wind gradients, and hail. There is also a smaller, but still important, threat from lightning. Statistics of the observations show that at any given time there is approximately a 10% probability of encountering severe icing conditions, approximately a 0.1% probability of encountering extreme turbulence, and approximately a 0.2% probability of encountering hail with mean diameter 2.5 cm or greater within convective clouds in the 4–7 km mean sea level altitude range. The purpose of this study is to analyze the convective environments under which these hazards occur in order to provide reference and/or guidance for conditions that might be encountered within summertime convective clouds by aircraft.",50,3
25,https://doi.org/10.2514/1.C032074,"The previous works of Prandtl, Jones, and Klein and Viswanathan addressed the problem of determining the lift distribution that minimizes induced drag for a given lift and specified bending moment. In these formulations, bending moment is considered to be a surrogate for wing weight. These classical methods require the bending constraints to be imposed at the same lift coefficient at which drag is minimized. In practice, however, it is commonly desired to minimize drag at a representative cruise lift coefficient while imposing the bending constraints at a limiting structural load condition, such as a maneuver lift coefficient. This paper presents an approach to extend the classical methods by allowing the bending constraints to be imposed at different lift coefficients than that at which induced drag is minimized. An example for a wing planform similar to that of a Boeing 737 shows that the penalty for optimizing induced drag at the maneuver lift coefficient as implied in the classical methods results in between a 1–10% increase in drag at cruise compared to the results from this new approach. It is expected that the new approach will enable the classical methods to be extended to practical applications in multidisciplinary wing design.",50,3
26,https://doi.org/10.2514/1.C032085,"The existing structural rating system in the maintenance steering group-3 is facing difficulties with developing new aircraft. There is always a lack of available data to help make proper inspection intervals. By taking advantage of the powerful learning ability and data fusion capability of the backpropagation network, this paper aims to develop a new decision support system for the determination of scheduled maintenance inspection intervals for aircraft structures susceptible to accidental damage. As long as various data are available, regardless of engineering experience, experimental values, and in-service reliability data feedback, the backpropagation network has been proven able to make acceptable predictions after training, making accidental damage rating a dynamic and flexible procedure.",50,3
27,https://doi.org/10.2514/1.C032102,"To understand the planform effects on low-Reynolds-number aerodynamic characteristics for micro air vehicles, various cambered thin plate wings were studied by numerical simulations based on Reynolds-averaged Navier–Stokes solutions with transition modeling. Six wing planforms, with the same wing aspect ratio and area, a positive camber at the quarter chord location, and a reflex camber near the trailing edge for longitudinal stability were selected for the study. They include a rectangular wing, four taped wings with the same taper ratio but different leading-edge sweeps, a Zimmerman wing, and an inverse-Zimmerman wing. For validation with available wind-tunnel experimental data, an investigation of a circular wing planform with a similarly cambered profile is also presented. The results show that the Zimmerman wing planform gives the best lift-to-drag ratio at the design condition, whereas the tapered wing with higher leading-edge sweep produces higher maximum lift. Flow separation and vortical flow structures on the upper wing surface are presented to gain insight into the different aerodynamic characteristics for the different planforms.",50,3
28,https://doi.org/10.2514/1.C032173,"The objective of the current paper is to present a Ritz-type solution for the buckling analysis of cracked-orthogonally stiffened panels. A cracked-orthogonally stiffened panel is defined as a rectangular plate with a crack and that has stiffeners that are parallel to one of its sides. Such structures are typically used as stiffened wing skins and fuselage skins in aerospace engineering. The behavior prediction of a cracked-stiffened panel using the Ritz approach is considered in the paper. In the Ritz-type solution, we use the local trigonometric trial functions to define the displacement function of the crack-stiffened panel, which is discretized into several elements based on the crack location and stiffener location. The interface continuity conditions for cracked thin-walled structures are derived and investigated in detail; the interface conditions are used to condense the global eigenvalue problem by eliminating redundant Ritz coefficients. Examples are presented to illustrate the effectiveness of the current model for buckling analysis. Buckling results from the current model are found to agree well with those obtained using a shell finite element method.",50,3
29,https://doi.org/10.2514/1.C032182,"One important element in the aerodynamic design of wind turbines is the use of specially tailored airfoils to increase the ratio of energy capture and reduce the cost of energy. This work is focused on the design of thick airfoils for wind turbines by using numerical optimization. A hybrid scheme is proposed in which genetic and gradient-based algorithms are combined together to improve the accuracy and the reliability of the design. First, the requirements and the constraints for this class of airfoils are described; then, the hybrid approach is presented. The final part of this work is dedicated to illustrate a numerical example regarding the design of a new thick airfoil. The results are discussed and compared to existing airfoils.",50,3
30,https://doi.org/10.2514/1.C031632,,50,3
31,https://doi.org/10.2514/1.C031866,,50,3
32,https://doi.org/10.2514/1.C031961,,50,3
33,https://doi.org/10.2514/1.C031987,,50,3
