,doi,abstract,volume,issue
20,https://doi.org/10.2514/1.C032675,"Evaluation of the conventional linear wall-interference correction method is conducted using flows around a two-dimensional airfoil in a wind tunnel computed by computational fluid dynamics and a porous wall model. First, the computational results are validated by comparison with wind-tunnel test measurements. Then, the wall-interference effect is discussed using these results. Porous walls are effective for reducing blockage, which change the Mach number around the airfoil. However, high wall porosity causes large downwash, which changes the flow angle. In this paper, Mokry’s method, which is one of the linear wall-interference correction methods, is evaluated quantitatively using computational fluid dynamics. Computational result with wind-tunnel walls are corrected by Mokry’s method, and the corrected result is compared with the one without wind-tunnel walls. Mokry’s method shows high accuracy in subsonic and no-stall conditions, which satisfy the requirement of the small-perturbation potential equation. Its accuracy is also high even if the model is large relative to the wind-tunnel size. However, an error of about 10 drag counts is caused due to a shock wave in transonic flow conditions, and accuracy rapidly degrades around the stall condition, where an error exceeding 100 counts is caused by flow separation.",52,1
21,https://doi.org/10.2514/1.C032676,"A low-speed wind-tunnel investigation was conducted to examine the effect of aspect ratio on ground effect. The characteristics of the wing and its section (a S8036 profile) were established at . The results indicate that ground effect is highly beneficial in augmenting lift, such that marked increases in the maximum lift-to-drag ratio may be realized. Finite wings in ground effect benefit from a reduction in vortex drag, as well as a lift increase, yielding greater gains in efficiency than achievable for an airfoil. The evaluation of analytic relations for estimation of the finite wing lift-curve slope and drag due to lift showed close accord with experiment.",52,1
22,https://doi.org/10.2514/1.C032678,"This study evaluates the feasibility of applying a newly developed dynamic hybrid Reynolds-averaged Navier–Stokes/large-eddy simulation modeling framework to predict the massively separated flow around a GLC-305 airfoil with a 22.5 min leading-edge glaze ice accretion. Three-dimensional numerical simulations were performed at , , and . Comparisons were made between experimental data and simulation results computed using two Reynolds-averaged Navier–Stokes models (Menter’s shear stress transport and Spalart–Allmaras) and two hybrid Reynolds-averaged Navier–Stokes/large-eddy simulation models (delayed detached-eddy simulation and the dynamic hybrid Reynolds-averaged Navier–Stokes/large-eddy simulation model). All models overpredicted the mean wall static pressures on the suction surface. Wall pressure predictions obtained using the Reynolds-averaged Navier–Stokes and dynamic hybrid Reynolds-averaged Navier–Stokes/large-eddy simulation models exhibited qualitatively better agreement with experiments than did delayed detached-eddy simulation predictions, and the dynamic hybrid Reynolds-averaged Navier–Stokes/large-eddy simulation model produced the best agreement for the mean streamwise velocity profiles. Turbulent intensity profiles showed substantial mesh sensitivity for the delayed detached-eddy simulation model simulations, whereas the dynamic hybrid Reynolds-averaged Navier–Stokes/large-eddy simulation model results qualitatively compared well with the experiments and exhibited only a small degree of mesh sensitivity. Unique to the dynamic hybrid Reynolds-averaged Navier–Stokes/large-eddy simulation simulations was the accurate prediction of the flow reattachment location. None of the Reynolds-averaged Navier–Stokes models predicted flow reattachment, and the delayed detached-eddy simulation model predicted a substantially delayed flow reattachment.",52,1
23,https://doi.org/10.2514/1.C032693,"Maximum rotor lift capability is investigated using wind-tunnel test data of McHugh (modified 1/10-scale CH-47B rotor) and a full-scale UH-60A rotor. Rotor performance calculations with the comprehensive rotorcraft analysis CAMRAD II are compared with the wind-tunnel test data. The analysis of the McHugh rotor with the Reynolds-number-corrected airfoil table shows good correlation with the measurements for to 0.5 and is able to predict the maximum rotor lift reasonably well, especially at . The analysis is also able to predict the maximum lift of the full-scale UH-60A rotor within about 3.5% at and 0.3. Calculations with dynamic stall models, in general, show only a small influence on the rotor performance and are not necessary to predict maximum lift. Airfoils have an important role in defining the maximum lift capability of the rotor. The VR-12 airfoil, which has stall characteristics superior to the baseline V23010 airfoil, substantially improves the maximum lift capability of the McHugh rotor, showing the potential to improve the behavior of a rotor by improving the airfoil’s static stall characteristics.",52,1
24,https://doi.org/10.2514/1.C032695,"Many current and future aircraft designs rely on the wing or other aircraft surfaces to shield observers on the ground from the engine noise. However, the available data showing how surfaces interact with a jet to shield and/or enhance the jet noise are currently limited. Therefore, far-field noise data and background-oriented schlieren images were acquired for a round jet, operating in the overexpanded, ideally expanded, and underexpanded supersonic flow regimes, near a planar surface to investigate how airframe surfaces might affect the shock-cell structure in the jet plume and the broadband shock noise produced. These data show that broadband shock noise is produced by the relatively weak shocks far downstream of the nozzle exit; consequently, a surface will be effective at reducing broadband shock noise only if it is long enough to shield the noise produced by shocks. Furthermore, the presence of a surface very near the edge of an underexpanded jet increases the shock-cell spacing, pushing the shock cells farther downstream. Conversely, the surface has a minimal affect on the shock cells in an overexpanded jet.",52,1
25,https://doi.org/10.2514/1.C032697,"The calculation of a flight plan involves the consideration of multiple elements. They can be classified as either continuous or discrete, and they can include nonlinear aircraft performance, atmospheric conditions, wind forecasts, airspace structure, amount of departure fuel, and operational constraints. Moreover, multiple differently characterized flight phases must be considered in flight planning. The flight-planning problem can be regarded as a trajectory optimization problem. A natural way to address a trajectory optimization problem is using optimal control techniques. The multiphase nature of the problem and the nonlinear dynamics of the aircraft lead to the formulation of a multiphase optimal control problem. A Hermite–Simpson collocation method is employed to transcribe the infinite-dimensional optimal control problem into a finite-dimensional optimization one, which is solved using a nonlinear programming solver. An application to the optimal takeoff weight, minimum fuel consumption trajectory planning problem is presented. Aircraft performances, flight procedures, and the resulting fuel consumption are analyzed. The problem is also solved for different takeoff weights and different cost indices. Their effects in the optimal performances are presented and discussed.",52,1
26,https://doi.org/10.2514/1.C032691,"Results from the Facility Analysis Verification and Operational Reliability project revealed a critical gap in capability in ground-based aeronautics-research applications. Without a standardized process for check loading the wind-tunnel balance or the model system, the quality of the aerodynamic force data collected varied significantly between facilities. The In Situ Load System was developed to provide a standard for facilities in the check-loading process. The system includes both the hardware and a statistically rigorous process that facilitates the ability for the user to make defendable decisions on the performance of the system. The compactness and simplicity of the system reduce customer costs unrelated to achieving the research objectives, while simultaneously improving the knowledge about the accuracy of the test data collected. While the focus is on the check-load process, the hardware and methods are also applicable to the in situ calibration of a balance or wind-tunnel model system.",52,1
27,https://doi.org/10.2514/1.C032721,"The flowfields around the NACA 0012 airfoil at Reynolds numbers , , and are studied, and the predictability of aerodynamic characteristics derived from various numerical methods is examined. Two-dimensional laminar simulation, two-dimensional Reynolds-averaged Navier–Stokes simulation using the Baldwin–Lomax turbulence model, and three-dimensional implicit large-eddy simulation are employed in this study. The two-dimensional laminar and three-dimensional implicit large-eddy simulations accurately predict the separation point, and capture the characteristics of a separation bubble for each Reynolds number and each angle of attack. Nonlinearity in the lift curve is also captured in the results of the two-dimensional laminar and three-dimensional implicit large-eddy simulations. The two-dimensional Reynolds-averaged Navier–Stokes simulation using the Baldwin–Lomax turbulence model predicts the separation point nearer the trailing edge than does the two-dimensional laminar and three-dimensional implicit large-eddy simulations, and the separation bubble is not captured for any Reynolds number and angle of attack by this method. Nonlinearity of the lift curve does not appear in the results of the two-dimensional Reynolds-averaged Navier–Stokes simulation using the Baldwin–Lomax turbulence model. The two-dimensional laminar simulation can predict airfoil aerodynamic characteristics qualitatively, and it can be used as an appropriate numerical method at lower Reynolds numbers. The three-dimensional-implicit-large-eddy-simulation technique can be employed when more accurate qualitative characteristics are needed.",52,1
28,https://doi.org/10.2514/1.C032725,"A coupled, partitioned fluid/structure-interaction analysis is introduced for calculation of the deformed equilibrium shape, aerodynamic coefficients, and actuation requirements of the fish-bone-active-camber morphing concept. The fish-bone-active-camber concept is a high-authority morphing camber architecture with a broad range of applications, including fixed-wing aircraft, helicopters, wind turbines, and tidal-stream turbines. The low chordwise bending stiffness of the morphing structure, high stiffness of the tendon drive system, and the large changes in aerodynamic loading while morphing necessitate a coupled fluid/structure-interaction analysis for determination of the static equilibrium. An Euler–Bernoulli beam-theory-based analytical model of the structure is introduced and validated. Aerodynamic loads are found using the XFOIL software, which couples a potential-flow panel method with a viscous boundary-layer solver. Finally, the tendons are modeled as linear stiffness elements whose internal strains are found from the Euler–Bernoulli theory, and whose axial forces create bending moments on the spine at their discrete mounting points. Convergence of the fluid/structure-interaction code is stabilized through incorporation of relaxation parameters. The results for two chosen test cases are presented to give an insight into the mechanical and aerodynamic behavior of the fish-bone-active-camber concept.",52,1
29,https://doi.org/10.2514/1.C032726,"As the emphasis on initiatives that can improve environmental efficiency while simultaneously maintaining economic viability has escalated in recent years, attention has turned to more radical concepts of operation. In particular, the cruiser–feeder concept has shown potential for a new generation, environmentally friendly, air-transport system to alleviate the growing pressure on the passenger air-transportation network. However, a full evaluation of realizable benefits is needed to determine how the design and operation of potential feeder-aircraft configurations impact on the feasibility of the overall concept. This paper presents an analysis of a cruiser–feeder concept, in which fuel is transferred between the feeder and the cruiser in an aerial-refueling configuration to extend range while reducing cruiser weight, compared against the effects of escalating existing technology levels while retaining the existing passenger levels. Up to 14% fuel-burn and 12% operating-cost savings can be achieved when compared to a similar technology-level aircraft concept without aerial refueling, representing up to 26% in fuel burn and 25% in total operating cost over the existing operational model at today’s standard fleet technology and performance. However, these potential savings are not uniformly distributed across the network, and the system is highly sensitive to the routes serviced, with reductions in revenue-generation potential observed across the network for aerial-refueling operations due to reductions in passenger revenue.",52,1
30,https://doi.org/10.2514/1.C032735,"The aerodynamics of a delta-wing aircraft is influenced by the ground effect during takeoff and landing. In this paper, the ground effect of a sharp leading-edge delta wing with sweep angle of 65 deg is investigated by using ANSYS Fluent employing the unsteady compressible Reynolds-averaged Navier–Stokes equations and the shear-stress transport turbulence model. The angle of attack is fixed at 20 deg and the flight height is varied from high altitude to close proximity to the ground. The lift, drag, and nose-down moment increase with decreasing flight height, and the major contribution to the variation in aerodynamic forces comes from the windward side of the wing. In ground effect, the pressure under the delta wing increases due to the “ramping” effect, the strength of the leading-edge vortex enhances before breakdown, and the vortex breakdown is promoted due to the increased adverse pressure gradient.",52,1
31,https://doi.org/10.2514/1.C032716,"The Strategic Research and Innovation Agenda and NASA goals have set new challenges for the aeronautical community via declaration of dramatic efficiency improvements. Because further evolutionary improvements do not appear to be sufficient, envisioning disruptive technologies turn out to be essential to reach the set of future targets. The design of innovative integrated energy–power systems is certainly a major promising element as can be shown by the increasing interest toward hybrid energy and universally electric aircraft. The consideration of these new types of aircraft represents a new challenge for conventional aircraft sizing and performance methods. As an extension of the conventional methods used for fuel-energy aircraft, a sizing and performance methodology for hybrid-energy aircraft is proposed. A design study of a battery and fuel hybrid-energy single-aisle retrofit is conducted to demonstrate the methodology and to analyze the implications of the associated new design variables on the sizing and performance. The benchmark against a conventional reference aircraft shows a potential block fuel-burn reduction up to 16% for a 900 n mile off-design mission stage length (using a mix of fuel energy to electrical energy of ). Clean sheet designs will be part of future work to assess the full potential of hybrid-energy aircraft.",52,1
32,https://doi.org/10.2514/1.C032484,,52,1
33,https://doi.org/10.2514/1.C032469,,52,1
34,https://doi.org/10.2514/1.C032552,,52,1
