,doi,abstract,volume,issue
19,https://doi.org/10.2514/1.C033962,"A numerical approach for assessing the degraded aerodynamics and flight characteristics of ice-contaminated helicopter rotors is proposed. A hybrid two- and three-dimensional loose coupling strategy between multibody dynamics modeling and computational fluid dynamics icing is formulated that attempts to balance computational resources, model complexity, and accuracy for use during the early design phases. A quasi-3D formulation that considers the heat transfer and the motion of the water film due to centrifugal effects is introduced. The method is suited for the analysis of rime, glaze, and/or mixed ice conditions. Degraded aerodynamic and dynamic characteristics of the iced rotor and the changes in flight performance are assessed. The technique has been applied to the scenario of isolated helicopter rotors in hover and in forward flight. Deterioration of the figure of merit is also presented.",55,3
20,https://doi.org/10.2514/1.C034628,"Based on the symmetrical conservative metric method, the high-order weighted compact nonlinear schemes with the Speziale–Sarkar–Gatski/Launder–Reece–Rodi- Reynolds stress model are applied to a series of separated flow cases in aeronautics. The relevant cases include the NASA CW-22 transonic turbine cascade, the NASA Common Research Model wing–body configuration, and the wingtip vortex on a NACA 0012 half-span wing. To assess the Reynolds stress model’s predictive capabilities, simulation results are compared with predictions by weighted compact nonlinear schemes with the Menter shear-stress transport model. Moreover, to demonstrate the advantage of high-order methods for separated flow simulations, the second-order method MUSCL is also adopted for comparisons.",55,3
21,https://doi.org/10.2514/1.C034601,"The single-aisle turboelectric aircraft with an aft boundary layer propulsor aircraft concept is estimated to reduce fuel burn by 12% through a turboelectric propulsion system with an electrically driven boundary layer ingestion propulsor mounted on the fuselage tail cone. This motivates a more detailed study of the boundary layer ingestion propulsor design, which requires considering the fully coupled airframe propulsion integration problem. However, boundary layer ingestion studies thus far have accounted only for the aerodynamic effects on the propulsion system, or vice versa, but have not considered the two-way coupling. This work presents a new approach for building fully coupled aeropropulsive models of boundary layer ingestion propulsion systems. A one-dimensional thermodynamic cycle analysis is coupled to a Reynolds-averaged Navier–Stokes simulation. This aeropropulsive model is used to assess how the propulsor design affects the overall performance for a simplified model of the single-aisle turboelectric aircraft with an aft boundary-layer propulsor. The results indicate that both propulsion and aerodynamic effects contribute equally toward the overall performance and that the fully coupled model yields substantially different results compared to the uncoupled model. Although boundary layer ingestion offers substantial fuel burn savings, it introduces propulsion-dependent aerodynamic effects that need to be accounted for.",55,3
22,https://doi.org/10.2514/1.C034401,"The use of active flow control technology for augmentation of aircraft aerodynamic performance is of considerable interest to the aerospace industry. Research to date has included subscale and full-scale wind-tunnel experiments as well as limited flight-test demonstrations. Out of several possible applications of active flow control to commercial aircraft, this paper focuses on its application to high-lift devices, which may permit weight and drag reduction through simplification of the flap mechanism. These, however, must be traded off against the additional weight of the active flow control system, its power requirements, and redundancy considerations to assess net system-level impacts. In this work, the Integrated Subsystem Sizing and Architecture Assessment Capability is used to assess the system-level impact of multiple high-lift device active flow control architectures for a small twin-aisle aircraft. A comparative assessment of these architectures reveals a strong dependency of fuel burn performance and the identity of the best-performing architecture on the system total mass flow requirements. For a selected architecture, the impact of the system mass flow requirements on the off-design performance is investigated. Despite an increase in vehicle operating empty weight, fuel consumption still decreases for most missions in the payload–range envelope. Finally, the sensitivity of the architecture’s performance to several sources of uncertainty is ascertained through a sensitivity analysis, and it is observed that the uncertainty in estimation of flap track fairing drag has the most significant impact on the estimation of mission fuel burn.",55,3
23,https://doi.org/10.2514/1.C034557,A low-speed wind-tunnel investigation is presented characterizing the performance of dual-lobed parawings. Parawings are conically shaped geometries that possess significant washout and camber variation across the span. A series of models with a planar leading-edge sweep of 55 deg increasing to 65 deg to form the parawing canopy were tested. Asymmetric wing tests were also conducted to explore the ability of the configurations to generate moments suitable for roll control. The results indicate a significant reduction in lift with increasing wing slackness stemming from both a reduction in the lift curve slope and positive shift in the zero-lift angle of attack. The angle of attack for zero lift is shown to correlate strongly with the peak lobe height. Asymmetric wing setting showed the generation of rolling moments comparable in magnitude with those produced by traditional ailerons. Numerical simulation indicated that a freely available lifting-surface theory application is able to accurately simulate the performance of the parawing geometry.,55,3
24,https://doi.org/10.2514/1.C034277,"This paper presents a successive derivation of basic equations in order to enlighten the implicit relationships between some of the most common objective functions employed in aircraft conceptual design. Correlation between financial and technical figures of merit relies on some important assumptions that may breakdown under certain circumstances, and therefore it is ill-advised to look for financially optimal designs using technical objective functions. As shown in the Results section, relationships between technical-only figures of merit hold and their behavior is even mathematically predictable. On the other hand, technical–financial relationships depend on market variables (price and market forecast, mainly) that can be captured only by proper market and financial models. In the Results section it is shown how optimization using technical-only objective functions overlooks important economical trades and thereby emphasizes the need for a proper modeling of such disciplines within the multidisciplinary analysis and optimization framework.",55,3
25,https://doi.org/10.2514/1.C034653,"This work considers a metallic aeroelastic wingbox model seeded with runout blade stiffeners along the skins. Topology optimization is conducted within the shell webs of the stiffeners in order to add cutouts and holes for mass reduction. This optimization is done with a global–local approach in order to moderate the computational cost: aeroelastic loads are computed at the wing level, but the topology and sizing optimization are conducted at the panel level. Each panel is optimized separately under stress, buckling, and adjacency constraints; and it is periodically reassembled to update the trimmed aeroelastic loads. The resulting topology is baselined against a design with standard full-depth solid stiffener blades, and it is found to weigh 7.43% less.",55,3
26,https://doi.org/10.2514/1.C034251,"This paper proposes an optimization framework that computes conflict-free optimal trajectories in dense terminal airspace, while continuously monitoring trajectory conformance in an effort to improve predictability. The objective is to allow, as much as possible, continuous vertical trajectory profiles without impacting negatively on airspace capacity. Given automatic dependent surveillance–broadcast intent information, the future state of potential intruder aircraft are predicted, and this nominal trajectory is used as a constraint in the ownship trajectory optimization process. In it, a continuous multiphase optimal control problem is solved, taking into account spatial and temporal constraints. Additionally, a linearized Kalman filter keeps track of the target by estimating the deviations of its actual trajectory from its nominal trajectory, issuing a warning when an appropriate threshold is exceeded. This may be due to unexpected events, biases in the performance and weather models, wrong parameter assumptions, etc. An illustrative example is given, based on a computer simulation of two hypothetical trajectories in the Barcelona terminal maneuvering area. The results show how this framework resolves the problem of uncertainties in the trajectory predictions and results in a more efficient conflict resolution.",55,3
27,https://doi.org/10.2514/1.C034605,"Through aerostructural optimization, this paper presents progress toward characterizing the potential efficiency gains of drooped wings for commercial aircraft in transonic flight. The drooped wing is a nonplanar configuration with downward spanwise camber from the wing root to the tip. The aerostructural optimization cases include two load conditions: cruise and . The single maneuver load condition is used for structural sizing of the wing. In all cases, the projected span of the wing remains unchanged. The results show that such a wing has the potential to improve aircraft range by 2.6% relative to an optimized planar wing of the same projected span. The reason is that the drooped wing pushes the tip vortex further away than the planar wing and increases the projected span at the deflected state. Furthermore, if the drooped wing is permitted to have curved leading and trailing edges, a 4.9% range improvement in comparison to an optimized planar wing with straight leading and trailing edges is possible by further reducing wing weight and wave drag.",55,3
28,https://doi.org/10.2514/1.C034572,"In the classical Stefan solution of solidification in liquids, the solid–liquid interface temperature is considered to be constantly equal to the freezing point. However, if solidification occurred in supercooled liquids, then the interface temperature would be lower than the freezing point due to the nonequilibrium condition. In this study, the interface temperature during rapid freezing of supercooled water is investigated by molecular dynamics simulations. The relationship of interface temperature and velocity is analyzed and fitted into a quadratic function. In most aviation ice accretion situations, the degree of nonequilibrium condition at the ice–water interface falls in a range of interfacial supercooling from 0 to 4 K. Given this condition, the relationship of interface velocity and temperature could be approximated by a constant interfacial kinetic coefficient of . Both regularities are applicable in numerical simulation of dendrite ice growth.",55,3
29,https://doi.org/10.2514/1.C034588,"The feasibility of employing a passive tip jet for enhancing the diffusion of the concentrated vorticity of blade-tip vortices is studied on a small-scale two-bladed propeller. The rotor employs hollow blades with slots for flow suction at the root and ejection at the tip. The centrifugal acceleration of the fluid created inside the blade by the rotational motion of the propeller is used to displace a considerable amount of flow momentum from the most inboard part of the blade to the tip. The particular technology is quite attractive because it does not require additional external power sources to drive the fluid. Test are performed in a low-speed wind tunnel with the propeller mounted at zero angle of attack. Oil-flow visualizations are used to characterize the change of the flow on the blade surface, whereas particle image velocimetry measurements are carried out to quantify the diffusion of the vorticity field obtained for three propeller advance ratios. Results show that the application of tip blowing considerably reduces the blade-tip vortex peak swirl velocity (33% for 0.24 propeller advance ratio) with a considerable increase in the vortex core radius (64% for 0.24 propeller advance ratio) and vortex diffusion. Although the fluid inside the propeller blade experiences viscous losses, no significant change of the blade performance is measured.",55,3
30,https://doi.org/10.2514/1.C034624,"In an effort to assess the suitability of the U.S. Army’s Rotorcraft Comprehensive Analysis System for calculating tiltrotor aeromechanics characteristics, comparisons of rotor performance and blade loads between calculations and test data are presented for the Tilt Rotor Aeroacoustic Model rotor in helicopter mode at an advance ratio of 0.15. For rotor performance, the comparisons are with test points that form shaft angle sweeps for two different thrust levels. These calculations include those from a free vortex wake model and those from coupling the comprehensive analysis to a viscous vortex particle method. The emphasis of this work is on the comparisons of blade loads, which are analyzed in detail for two test points with a 3 deg forward shaft tilt and different thrust levels. Blade airloads calculations include the two aforementioned sets of calculations, whereas blade structural loads calculations also include those from prescribing experimentally measured airloads. The level of agreement between calculations with the free vortex wake model and test data is generally comparable with those of helicopter rotors at similar conditions. The level of agreement improves with the viscous vortex particle method. Meanwhile, some deficiencies in structural loads calculations with prescribing measured airloads are noted.",55,3
31,https://doi.org/10.2514/1.C034197,,55,3
32,https://doi.org/10.2514/1.C034629,,55,3
33,https://doi.org/10.2514/1.C034639,,55,3
