,doi,abstract,volume,issue
22,https://doi.org/10.2514/1.C034667,"Air transport planning takes new technologies, strategies, and procedures into consideration when optimizing both trajectory and air traffic management. Continuous Climb operations (CCO) are new optimal departing trajectories that minimize fuel consumption, emissions, and noise levels within the vicinity of airports. In contrast with previous research, this paper does not focus on the optimization techniques of these procedures but on the estimation of novel separation minima. First, the authors present the CCO model: climbing structure, operational concept, and simulations. Second, Monte Carlo simulations are performed to obtain a large, statistically significant sample. The uncertainty of CCO trajectories is modeled taking several factors into account, such as aircraft type, mass, speed, positioning error, temperature, and wind. Mass is the factor that adds most uncertainty to climbing trajectories. Afterward, the authors develop a conflict-resolution algorithm to perform systematic analysis of separation minima. This algorithm has two goals: 1) to ensure that separation minima between aircraft pairs performing CCO are not violated throughout the departure, and 2) to dynamically calculate the on-ground separation between CCO. To the best of the authors’ knowledge, this is the first time that an attempt has been made to quantify CCO separation minima. The results of the simulation confirm that the new CCO separation minima are larger than standard separation minima.",56,1
23,https://doi.org/10.2514/1.C034882,"The goal of the present work is to develop a high-fidelity nonlinear finite element (FE) model able to describe the mechanical response of an aircraft structure composed of a pylon, sway braces, and a store system with an applied external load. Unstable phenomena (such as limit cycle oscillations) on aircraft pylons have been shown to occur because of the presence of nonlinearities (structural and aerodynamic). Most previous investigations mainly focused on aerodynamic effects while almost neglecting structural effects. The present paper, however, focuses on the building and assessment of a nonlinear FE structural model of a pylon, starting from experimental evidence, showing that nonlinearities are concentrated in the joint between the pylon and the suspended store. The static results of the numerical model were assessed by means of an experimental stiffness test. The dynamical reliability of the model was assessed when linked to a delta cropped wing comparing its vibration modes with experimental values and with a linear model. The results demonstrate that the FE model is able to accurately replicate both the static and dynamic behavior of the system.",56,1
24,https://doi.org/10.2514/1.C034849,"Accurate predictions of aircraft noise levels are desirable to enforce noise control regulations around airports and to evaluate noise abatement procedures. The current best practice noise contour prediction models assume certain default net thrust values depending on the engine type and aircraft altitude. This Paper proposes a method for calculating the engine fan settings (and, hence, the net thrust) directly from audio recordings. This method was tested with a large number of Airbus A330–300 and Boeing 777–200 flyover audio recordings. A significant correlation was found between the recorded noise levels and , explaining up to 45% of the variability in the noise levels. Using the calculated values in the noise prediction models, instead of the default values, increases the agreement with the actual recorded noise levels and explains parts of the variability. The inclusion of accurate values of and the update of the aircraft noise prediction calculations is therefore highly encouraged, for example, by increasing the dependency on of the noise levels.",56,1
25,https://doi.org/10.2514/1.C034978,"Wingtip-mounted propellers installed in a tractor configuration can decrease the wing induced drag by attenuating the wingtip vortex by the propeller slipstream. This paper presents an aerodynamic analysis of the propeller–wing interaction effects for the wingtip-mounted propeller configuration, including a comparison with a conventional configuration with the propeller mounted on the inboard part of the wing. Measurements were taken in a low-speed wind tunnel at Delft University of Technology, with two wing models and a low-speed propeller. Particle-image-velocimetry measurements downstream of a symmetric wing with integrated flap highlighted the swirl reductions characteristic of the wingtip-mounted propeller due to wingtip-vortex attenuation and swirl recovery. External-balance and surface-pressure measurements confirmed that this led to an induced-drag reduction with inboard-up propeller rotation. In a direct comparison with a conventional propeller–wing layout, the wingtip-mounted configuration showed a drag reduction of around 15% at a lift coefficient of 0.5 and a thrust coefficient of 0.12. This aerodynamic benefit increased upon increasing the wing lift coefficient and propeller thrust setting. An analysis of the wing performance showed that the aerodynamic benefit of the wingtip-mounted propeller was due to an increase of the wing’s effective span-efficiency parameter.",56,1
26,https://doi.org/10.2514/1.C033911,"In this study, the effects of the flight-path angle (FPA) ranging between 1.0 and 4.5 deg during a continuous descent approach, on certain fuel-related parameters such as fuel flow, fuel burn per 1000 ft of altitude, and specific range, are investigated. The dataset, obtained from Turkish Airlines, includes 4384 eligible flight data records of narrow-bodied commercial aircraft performing 9351 domestic flights between 30 city pairs, across Turkey. The results indicate that the fuel flow is a strong linear function of FPA up to 2.5–3.0 deg for all of the aircraft types, whereas the effect diminishes above 3.0 deg. There is a monotonic decrease of the fuel burn per 1000 ft of altitude with an increase in the FPA, with the trend being stronger than that for fuel flow. Even though the fuel consumption of the descent flight significantly decreases with steeper FPAs, the effect of the FPA on the total fuel consumption of the flight seems not as straightforward as it does when considering only the descent phase. A case study based on this model indicates a U-shaped pattern for total fuel burn with an increase in the FPA, in which the highest fuel saving relative to 1.0 deg of the FPA is calculated to be 14.0% (191 kg) at 2.5 deg of the FPA.",56,1
27,https://doi.org/10.2514/1.C034219,"Real-time estimation of dynamic model parameters for an unmanned aircraft can provide valuable information about the dynamics of the vehicle. However, the aircraft model estimation performance can be severely degraded with an active control system and highly collinear model terms such as those found on a quadrotor unmanned aircraft. Model parameters were estimated based on dynamic flight data of a quadcopter aircraft. System identification maneuvers were generated using varying-amplitude orthogonal multisine input signals applied on a quadcopter with nominal hardware conditions and with a damaged propeller. Recursive Fourier transform regression was applied to dynamic data to estimate parameters of two input model forms: independent and delta input. Prediction capability of the identified models was assessed using data of nearly the same flight conditions. Results indicated that, as the amplitude of the input multisine increased, the identifiability of control effectiveness improved, and prediction error decreased. Overall, a well-designed multi-input multisine input design and Fourier transform regression applied together provided efficient and accurate real-time parameter estimation that effectively overcame challenges imposed by a system subjected to closed-loop control with collinear model terms.",56,1
28,https://doi.org/10.2514/1.C034863,"This paper presents the application of a new method, called higher-order dynamic mode decomposition (HODMD), to extract aircraft frequencies and damping in experimental data obtained from a flight flutter test. The method is an extension of standard dynamic mode decomposition, which is a method typically used to extract flow patterns and frequencies from unsteady fluid dynamics measurements or numerical simulations. In the fluid dynamic field, HODMD has proven to be a very efficient, robust, and accurate method to extract modes, frequencies, and damping from very noisy and large signals, with reduced manual interaction. In a similar way, this paper shows the good performance of this method when it is applied to the noisy data of this complex experiment. This fact sheds light on the new possibilities for the aerospace industry to incorporate HODMD to perform robust analyses.",56,1
29,https://doi.org/10.2514/1.C035022,"This paper outlines the development of a parallel three-dimensional hybrid finite volume finite difference capability. The specific application area under consideration is modeling the trailing vortices shed from the wings of aircraft under transonic flight conditions. For this purpose, the Elemental finite volume code is employed in the vicinity of the aircraft, whereas the ESSENSE finite difference software is employed to accurately resolve the trailing vortices. The former method is spatially formally second-order, and the latter is set to sixth-order accuracy. The coupling of the two methods is achieved in a stable manner through the use of summation-by-parts operators and weak imposition of boundary conditions using simultaneous approximation terms. The developed hybrid solver is successfully validated against an analytical test case. This is followed by demonstrating the ability to model the flowfield, including trailing vortex structures, around the NASA Common Research Model under transonic flow conditions. The interface treatment is shown to describe the intersecting vortices in a smooth manner. In addition, insights gained in resolving the vortices include violation of underlying assumptions of analytical vortex modeling methods.",56,1
30,https://doi.org/10.2514/1.C034992,"The current study considers an analysis of hyperelliptic cambered span wing configurations, optimized for minimum drag. This study encompasses a multidimensional design optimization approach wherein the wing geometries are optimized with respect to both span load and spanwise camber to achieve minimum aerodynamic drag. A discrete vortex element method was coupled with a constrained gradient-based optimization routine to achieve these drag-optimal design configurations. Optimum drag configurations were obtained at a fixed design lift coefficient as well as a fixed bending moment constraint. Navier–Stokes simulations were also performed, which revealed an gain of 29.01 and 25.35% at design conditions, relative to an elliptically loaded planar wing for the upward and downward cant configurations, respectively. Different wake trace characteristics for the two hyperelliptic cambered span configurations were observed along with surface flow features indicating different wake vortex and boundary-layer transition behaviors for the two hyperelliptic cambered span configurations.",56,1
31,https://doi.org/10.2514/1.C034967,"Nonmorphing, conventional aircraft wings are designed for a compromise of good performance at a variety of flight conditions. Accordingly, such wings perform suboptimally when considered at a single flight condition. Morphing trailing-edge devices offer an opportunity to change this wing design paradigm by allowing wings to adapt to varying flight conditions. This adaptability weakens the correlation between performance at various flight conditions and increases the robustness of the wing’s performance, providing closer-to-optimal performance at each flight condition. To study the isolated aerodynamic effects of this increased robustness, we perform a number of aerodynamic and aerostructural shape optimizations of a morphing trailing-edge device that can change the shape of the rear 10% of the wing at a variety of flight conditions on the Common Research Model aircraft configuration. The aerodynamically optimized morphing configuration yields a 1.0% fuel burn reduction for a long-range mission. When performing aerostructural optimization, which considers structural deformations and structural weight reductions enabled by active load alleviation, the fuel burn reduction is 2.7%.",56,1
32,https://doi.org/10.2514/1.C034886,,56,1
33,https://doi.org/10.2514/1.C034920,,56,1
34,https://doi.org/10.2514/1.C035041,,56,1
35,https://doi.org/10.2514/1.C034813,,56,1
36,https://doi.org/10.2514/1.C035034,,56,1
37,https://doi.org/10.2514/1.C034445,,56,1
