,source,reqs
106,2005 - phin.xml,"Contact information for key response partner organizations should be stored in a local instance of a public health directory for associating to a health event, as described in section 2.2.2 Health event Data of this document."
107,2005 - phin.xml,Systems supporting OM must be able to accept data from other partner systems supporting OM.
108,2005 - phin.xml,"Systems supporting OM must be able to create and send messages for laboratory test requests. This requirement is identified as a key performance measure for assessing preparedness as described in PHIN Preparedness Key Performance Measures, available at www.cdc.gov/phin."
109,2005 - phin.xml,"Systems supporting OM should be able to receive, parse and process messages for laboratory test request responses, in accordance with PHIN Laboratory Test Order Response Message Implementation Guide, available at www.cdc.gov/phin."
110,2005 - phin.xml,"Systems supporting OM must be able to receive, parse and process messages for laboratory results. This requirement is identified as a key performance measure for assessing preparedness as described in PHIN Preparedness Key Performance Measures, available at www.cdc.gov/phin."
111,2005 - phin.xml,"Laboratory results should be linked to laboratory test requests, which are linked to subjects."
112,2005 - phin.xml,"Systems supporting OM should be able to exchange messages for laboratory results with systems supporting surveillance, early event detection (EED), and other preparedness areas."
113,2005 - phin.xml,"Systems supporting OM must be able to exchange messages for confirmed, probable and suspect cases, and the other case classifications that are noted in the PHIN message implementation guide, with systems supporting surveillance, early event detection (EED), and other preparedness areas. This requirement is identified as a key performance measure for assessing preparedness as described in PHIN Preparedness Key Performance Measures, available at www.cdc.gov/phin."
114,2005 - phin.xml,"Systems supporting OM must exchange messages for investigations and for exposure contacts. This requirement is identified as a key performance measure for assessing preparedness as described in PHIN Preparedness Key Performance Measures, available at www.cdc.gov/phin."
115,2005 - phin.xml,"Systems supporting OM must be able to receive, parse and process messages for countermeasures that have been administered. This requirement is identified as a key performance measure for assessing preparedness as described in PHIN Preparedness Key Performance Measures, available at www.cdc.gov/phin."
116,2005 - phin.xml,Countermeasures that have been administered must be linked to the entity that was administered the countermeasures.
117,2005 - phin.xml,"Systems supporting OM must be able to create and send messages for countermeasure administration requests. This requirement is identified as a key performance measure for assessing preparedness as described in PHIN Preparedness Key Performance Measures, available at www.cdc.gov/phin."
118,2005 - phin.xml,"Systems supporting OM must be able to exchange aggregated data. Examples of aggregated data to be supported are: number of cases, number of contacts per case, and number of vaccinations and/or treatments administered."
119,2005 - phin.xml,"Systems supporting OM should be able to provide the aggregate data necessary for health event monitoring to systems that support response tracking, such as the number of suspect cases, number of persons under isolation or quarantine, and the number of patients receiving countermeasures."
120,2005 - phin.xml,Mapping interfaces and data dictionaries must be clearly defined and included in data exchanges to indicate and describe both standard and customized fields because systems supporting OM are configurable to meet the individual needs of each event and therefore collect data specific to each event.
121,2005 - phin.xml,"Message components should be grouped by observation type (e.g., laboratory, symptom, exposure, risk, treatment) by systems supporting OM."
122,2005 - phin.xml,"Systems supporting OM should support multiple file formats for import and export, such as databases, spreadsheets, messages, and text files, among others"
