,doi,abstract,volume,issue
18,https://doi.org/10.2514/1.B34754,"The coaxial magnetoisolated longitudinal anode concept was introduced to improve efficiency and lifetime of low-power Hall thrusters . The coaxial magnetoisolated longitudinal anode represents a significant departure from conventional Hall thrusters and has not been thoroughly studied yet. The high efficiency of the thruster, as validated by measurements, increases the need for a better understanding of the physical processes in this type of thruster. An analysis of the coaxial magnetoisolated longitudinal anode discharge based on experimental measurements was conducted for this aim. The experimental setup includes electrical probes mounted on a fast moving positioner, enabling one to obtain the spatial distribution of plasma parameters inside the thruster channel. The results confirmed the basic assumptions used in the physical model of the coaxial magnetoisolated longitudinal anode concept and revealed new phenomena related to the radial nonuniformity of the discharge. In particular, focusing equipotentials were discovered not only in the anode cavity but also in the dielectric channel, where the area of intense ionization was located. The physical processes contributing to the formation of the focusing equipotentials are discussed.",29,4
19,https://doi.org/10.2514/1.B34711,"This paper develops a novel strategy for prediction of lean blowout in gas turbine combustors based on symbolic analysis of time series data from optical sensors, where the range of instantaneous data is partitioned into a finite number of cells and a symbol is assigned to each cell. Depending on the cell to which a data point belongs, a symbolic value is assigned to the data point. Thus, the set of time series data is converted to a symbol string. The (estimated) state probability vector is computed based on the number of occurrence of each symbol over a given time span. For the purpose of detecting lean blowout in gas turbine combustors, the state probability vector obtained at a condition sufficiently away from lean blowout (reference state) is considered as the reference vector. The deviation of the current state vector from the reference state vector is used as an anomaly measure for early detection of lean blowout. The results showed that the rate of change of the anomaly measure with equivalence ratio changed significantly as the system approached lean blowout. This change in slope of the curve was observed approximately at a similar proximity to lean blowout for different operating conditions and, hence, could be used as an early lean blowout precursor. The actual location of the change of slope depended primarily on the choice of reference state. This technique performed satisfactorily over a wide range of premixing.",29,4
20,https://doi.org/10.2514/1.B34747,"This experimental study investigates the influence of fuel distribution on ignition outcome during high-altitude relight of a gas turbine. Planar laser-induced fluorescence is used to image fuel inside a lean direct-injection combustor under realistic conditions. A novel apparatus is developed to permit planar laser-induced fluorescence imaging, in which large quantities of poorly atomized fuel impinges on the internal surfaces of the combustor. Results reveal high variability in atomization quality. In the absence of flame, small droplets are confined to areas of recirculating flow, whereas large droplets impact on the walls. All fuel is introduced through a pilot air-blast atomizer close to the injector centerline. However, comparatively little fuel is apparent near the igniter tip because the outside swirlers of the fuel injector create a fast-moving stream of fuel-free air that flows directly below the upper combustor wall. The droplet size and fuel concentration in the main recirculation zone do not differ radically at test conditions with markedly different fuel-to-air ratios, suggesting that turbulent straining is a more important factor than equivalence ratio in the failure of ignition when the airflow rate is high. In the presence of flame, medium-sized burning droplets are observed close to the injector centerline. Flame interference resulting from fluorescence of polycyclic aromatic hydrocarbons is apparent, but small, suggesting that kerosene planar laser-induced fluorescence is a useful tool for the analysis of all stages of altitude relight.",29,4
21,https://doi.org/10.2514/1.B34658,"The propellant feed valves of a cryogenic rocket engine are usually opened some time before ignition to allow cold propellants to enter the engine feed system and reduce its temperature. This process is commonly known as chilldown. Numerical studies can support its optimization but often suffer from modeling difficulties and excessive run times. These disadvantages are partly circumvented by geometrically simplifying the fuel pump and using a computational fluid dynamics method to generate its chilldown performance map. In a second step, the map is used in a system simulation for a real upper stage, and the predictions are compared with flight data. The results mostly lie within a few percent of the latter.",29,4
22,https://doi.org/10.2514/1.B34569,"Experiments were undertaken to investigate the variation in thrust and combustion efficiency of a three-dimensional scramjet operating in different modes. The scramjet flowpath included a rectangular-to-elliptical shape transition inlet and a divergent elliptical combustion chamber, and the experiments replicated conditions for flight at Mach 8 and 32 km altitude. Two combustion chamber configurations were tested with the same overall length and area ratio, but with different lengths of constant area section before divergence. Injection of the hydrogen fuel was through portholes at the combustion chamber entrance. Both engine configurations underwent a significant change in operating character with increasing equivalence ratio that was consistent with a change from “supersonic” to “separated” combustion in a dual-mode scramjet. The configuration with longer constant area section changed mode at an equivalence ratio just less than one, with an abrupt increase in thrust. This was accompanied by a significant increase in the calculated fuel-based combustion efficiency from 25 to 72%. Mode change occurred at a significantly higher equivalence ratio for the combustor with shorter constant area section, indicating that small changes in combustor area distribution can have important effects on scramjet operability and performance.",29,4
23,https://doi.org/10.2514/1.B34653,"Lean combustion concepts for aircraft engines are more susceptible to combustion instabilities. Prior activity has demonstrated active control to suppress combustion instabilities with a conventional rich-front-end combustor. The current effort is developing further understanding of the problem specifically as applied to future lean-burning, very low-emissions aircraft engine combustors. A prototype low-emissions aircraft engine combustor with a combustion instability has been identified and previous work has characterized the combustor’s dynamic behavior. The combustor exhibits thermoacoustic instabilities related to increasing fuel flow that prevent full-power operation. Active combustion instability suppression using the adaptive sliding phasor average control method has been demonstrated experimentally with this combustor prototype in a combustion test cell operating at engine pressures, temperatures, and flows. A high-frequency fuel valve perturbed the combustor fuel flow. Successful instability suppression was shown using a dynamic pressure sensor in the combustor for controller feedback. Instability control was also shown with a pressure feedback sensor in the lower temperature region, upstream of the combustor. It was also demonstrated that the controller can prevent the instability from occurring while combustor operation was transitioning from a stable low-power condition to a normally unstable high-power condition, thus enabling the high-power condition.",29,4
