,doi,abstract,volume,issue
25,https://doi.org/10.2514/1.B35981,"Blade-row interactions drive unsteady blade forces in compressors. This paper presents a perspective on understanding how the pitchwise variations in the flow at the exit of the rotor affect the surface pressures on the downstream vane. The rotor wakes and tip leakage flows are the primary unsteady flow features that drive unsteady lift on the vane. However, those rotor flow features are affected by their interaction with the wakes from upstream vanes. Thus, the interaction with stator 1 and rotor 2 must be understood to adequately characterize the interaction between rotor 2 and stator 2. This paper uses vane clocking, or the circumferential shift in successive vane rows of similar counts, to illuminate these blade-row interaction effects on the downstream vane surface pressure distribution. To accomplish this, experiments are performed in a three-stage axial compressor where high-frequency response pressure transducers are flush-mounted in the stator 2 pressure and suction surfaces are flush-mounted at 50 and 80% spans. Results show that rotor 1–rotor 2 interactions contribute significantly to the changes in unsteady stator surface pressure over the course of a rotor revolution. Also, the rotor 1–rotor 2 interaction levels change in the pitchwise direction downstream of the rotor; thus, the changes in surface pressure are affected by vane clocking. Furthermore, the rotor tip leakage flow is an additional contributor to the unsteady stator surface pressures measured at 80% span, providing an additional pressure peak per blade passing, and thus more high-frequency content (twice the blade-passing frequency).",33,1
26,https://doi.org/10.2514/1.B36236,"Ignition in a supersonic hydrogen–air mixing layer interacting with an oblique shock wave is investigated analytically under conditions such that the postshock flow is supersonic and the peak postshock temperature before ignition remains below the crossover temperature. The study requires consideration of the flow structure in the postshock ignition kernel found around the point of maximum temperature, which is assumed in this study to lie at an intermediate location across the mixing layer, as occurs in mixing layers subject to significant viscous dissipation. The ignition kernel displays a balance between the rates of chemical reaction and postshock flow expansion, including the acoustic interactions of the chemical heat release with the shock wave leading to increased front curvature. The problem is formulated with account taken of the strong temperature dependence of the chemical heat-release rate characterizing the ignition chemistry in the low-temperature regime analyzed here. It is shown how consideration of a two-step reduced chemical–kinetic mechanism derived in previous work leads to a boundary-value problem that can be solved analytically to determine ignition as a fold bifurcation, with the turning point in the diagram of peak perturbation induced by the chemical reaction as a function of the Damköhler number providing the critical conditions for ignition.",33,1
27,https://doi.org/10.2514/1.B35847,"Ion thruster plumes are simulated under a framework that was recently developed to take advantage of the large scalability of unstructured grids using adaptive mesh refinement. Momentum and charge-exchange collisions occurring between neutral and ion species, as well as the induced electric field due to ions, have been performed using multiple adaptive mesh refinement meshes to study the backflow of an ion thruster to a spacecraft surface. Furthermore, the ions and neutral species are directly coupled, which is found to have a 15% effect on the neutral species velocity profiles. The backflow for ions is found to occur when charge-exchange and momentum-exchange collisions are present, and then it is strongly enhanced when the induced electric field is considered. The ion energy distributions in the backflow region are obtained, and it is found that the inclusion of the electric field modeling is the most important factor in determining its shape. The plume backflow structure is also examined for a triple-thruster three-dimensional geometry case, and it is found that the ion velocity in the backflow region appears to be roughly independent of the number of thrusters. Finally, the influence of solar cell panel voltage on backflow fluxes is evaluated using a combined commercial software-generated potential with the induced potential, and the influence of gas–surface interactions is studied.",33,1
28,https://doi.org/10.2514/1.B35871,"This contribution focused on the analysis of weld-joint effects resulting from the assembly of the blades and disk for the compressor blades. Experiments at the von Kármán Institute and computational fluid dynamics simulations at Cenaero were conducted to study the flowfield in a low-pressure high-speed compressor cascade with two weld-joint configurations. Experiments were performed to measure the total pressure loss coefficient for various inlet flow conditions. Reynolds-averaged Navier–Stokes simulations using the turbulence model were carried out. Comparison between the Reynolds-averaged Navier–Stokes solutions and the experiments were made, and the accuracy of the results was investigated. The impact of the weld-joint height and the upstream boundary layer on the losses was studied. In addition, the effect of the weld-joint heights on the growth of the boundary layer was analyzed and presented.",33,1
29,https://doi.org/10.2514/1.B36108,"The latest combustion model-validation experiments are presented using a time-, space-, and polarization-resolved subframe-burst gating Raman spectroscopy system. A modification to the original subframe-burst gating diagnostics system enables parallel detection of both polarized and depolarized Raman components for the first time in a high-pressure flame tube, which permits signal detection with reduced background noise, and consequently more precise determination of temperature and species in optically harsh flames. This technique is applied to the measurement of mass fractions of the major species and temperature in a swirl-stabilized hydrogen-methane flame at an elevated pressure of 15.5 bar. The single-shot linear Raman spectra are reduced to provide quantitative multiscalar information throughout the primary reaction zone. The experimental dataset is plotted along with the laminar flamelet calculations for different Lewis numbers and strain rates to allow better interpretation. Time-dependent analysis of the recorded samples using cross correlations, probability density functions, and scatter plots reveals the characteristic behavior of the quantities over a range of mixture fractions, including the local flame structure and the influence of turbulence–chemistry interactions.",33,1
